Rem provident aut deserunt alias quidem id;Tarefa a Ser Feita;2;2024-02-16 23:40:37;2024-07-03 23:40:37;2;Concluído;Pedro da Silva;f9a533f2c78e4a09f87c9e68e442d3fe
Comprar quibusdam;Item de Compra;1;2024-03-22 13:59:00;;3;Cancelado;Pedro da Silva;f9a533f2c78e4a09f87c9e68e442d3fe
Provident perferendis nam voluptatum earum;Tarefa a Ser Feita;2;2023-11-06 05:34:57;;3;Cancelado;Pedro da Silva;f9a533f2c78e4a09f87c9e68e442d3fe
Comprar saepe;Item de Compra;1;2023-12-15 03:07:48;;1;A Fazer;Pedro da Silva;f9a533f2c78e4a09f87c9e68e442d3fe
Occaecati dolore quos sint vitae ipsam optio;Tarefa a Ser Feita;2;2023-10-04 22:59:02;;1;A Fazer;Pedro da Silva;f9a533f2c78e4a09f87c9e68e442d3fe
Consequatur sed repudiandae;Tarefa a Ser Feita;2;2024-05-15 18:32:36;;1;A Fazer;Pedro da Silva;f9a533f2c78e4a09f87c9e68e442d3fe
Quo rerum quis numquam;Tarefa a Ser Feita;2;2024-08-20 23:57:56;;3;Cancelado;Jeferson Klau;b4853fc1f03a3a4cec530a98a94d89ad
Aut quae odio quasi;Tarefa a Ser Feita;2;2024-07-27 11:49:56;;3;Cancelado;Pedro da Silva;f9a533f2c78e4a09f87c9e68e442d3fe
Recusandae eius hic inventore;Tarefa a Ser Feita;2;2025-02-26 03:04:52;;3;Cancelado;Jeferson Klau;b4853fc1f03a3a4cec530a98a94d89ad
Vitae impedit;Tarefa a Ser Feita;2;2023-11-13 06:22:59;;1;A Fazer;Pedro da Silva;f9a533f2c78e4a09f87c9e68e442d3fe
Reprehenderit facilis voluptatem;Tarefa a Ser Feita;2;2023-10-24 10:00:59;;3;Cancelado;Jeferson Klau;b4853fc1f03a3a4cec530a98a94d89ad
Comprar tempore;Item de Compra;1;2023-06-04 15:03:13;2024-04-27 15:03:13;2;Concluído;Pedro da Silva;f9a533f2c78e4a09f87c9e68e442d3fe
Reiciendis ipsum;Tarefa a Ser Feita;2;2024-08-28 02:31:50;2024-11-09 02:31:50;2;Concluído;Pedro da Silva;f9a533f2c78e4a09f87c9e68e442d3fe
Illo totam blanditiis tenetur;Tarefa a Ser Feita;2;2025-04-30 16:22:29;;1;A Fazer;Pedro da Silva;f9a533f2c78e4a09f87c9e68e442d3fe
Maiores reiciendis adipisci;Tarefa a Ser Feita;2;2024-07-04 07:54:30;;3;Cancelado;Pedro da Silva;f9a533f2c78e4a09f87c9e68e442d3fe
Eligendi explicabo autem eveniet fugit;Tarefa a Ser Feita;2;2024-04-17 16:44:45;;3;Cancelado;Pedro da Silva;f9a533f2c78e4a09f87c9e68e442d3fe
Comprar illo;Item de Compra;1;2025-04-06 19:57:45;2025-06-02 21:17:40;2;Concluído;Jeferson Klau;b4853fc1f03a3a4cec530a98a94d89ad
Comprar eos;Item de Compra;1;2025-05-13 14:57:38;;1;A Fazer;Jeferson Klau;b4853fc1f03a3a4cec530a98a94d89ad
Comprar sit;Item de Compra;1;2025-04-16 03:16:59;;3;Cancelado;Pedro da Silva;f9a533f2c78e4a09f87c9e68e442d3fe
Cumque dolores doloremque quibusdam aliquam molestiae;Tarefa a Ser Feita;2;2025-03-19 04:39:29;;1;A Fazer;Pedro da Silva;f9a533f2c78e4a09f87c9e68e442d3fe
Quod eos accusamus fugit rem sint;Tarefa a Ser Feita;2;2025-03-30 14:12:57;;1;A Fazer;Pedro da Silva;f9a533f2c78e4a09f87c9e68e442d3fe
Animi modi ex;Tarefa a Ser Feita;2;2024-10-22 21:06:48;2025-05-01 21:06:48;2;Concluído;Jeferson Klau;b4853fc1f03a3a4cec530a98a94d89ad
Qui earum at;Tarefa a Ser Feita;2;2024-06-04 00:18:59;;3;Cancelado;Pedro da Silva;f9a533f2c78e4a09f87c9e68e442d3fe
Provident quisquam;Tarefa a Ser Feita;2;2024-04-01 10:04:07;2025-03-06 10:04:07;2;Concluído;Pedro da Silva;f9a533f2c78e4a09f87c9e68e442d3fe
Voluptate quisquam laborum;Tarefa a Ser Feita;2;2024-08-06 13:24:35;;3;Cancelado;Jeferson Klau;b4853fc1f03a3a4cec530a98a94d89ad
Incidunt quae reiciendis;Tarefa a Ser Feita;2;2024-11-20 15:08:45;2024-11-29 15:08:45;2;Concluído;Jeferson Klau;b4853fc1f03a3a4cec530a98a94d89ad
Quasi voluptatem eaque laudantium fuga;Tarefa a Ser Feita;2;2025-05-12 09:45:43;2025-06-02 21:42:40;2;Concluído;Pedro da Silva;f9a533f2c78e4a09f87c9e68e442d3fe
Accusamus optio nisi impedit dolores;Tarefa a Ser Feita;2;2024-03-18 08:48:16;;3;Cancelado;Jeferson Klau;b4853fc1f03a3a4cec530a98a94d89ad
Ipsam quaerat ex;Tarefa a Ser Feita;2;2024-10-17 10:20:57;2024-11-11 10:20:57;2;Concluído;Pedro da Silva;f9a533f2c78e4a09f87c9e68e442d3fe
Earum quo nesciunt provident;Tarefa a Ser Feita;2;2024-11-16 22:24:45;;3;Cancelado;Jeferson Klau;b4853fc1f03a3a4cec530a98a94d89ad
Tempore ut quaerat rerum numquam optio nulla blanditiis;Tarefa a Ser Feita;2;2024-01-18 21:56:42;2024-11-02 21:56:42;2;Concluído;Jeferson Klau;b4853fc1f03a3a4cec530a98a94d89ad
Comprar nostrum;Item de Compra;1;2023-11-02 19:49:19;2024-03-01 19:49:19;2;Concluído;Jeferson Klau;b4853fc1f03a3a4cec530a98a94d89ad
Comprar error;Item de Compra;1;2024-06-03 18:29:02;;3;Cancelado;Pedro da Silva;f9a533f2c78e4a09f87c9e68e442d3fe
Comprar id;Item de Compra;1;2023-09-08 21:23:52;;1;A Fazer;Jeferson Klau;b4853fc1f03a3a4cec530a98a94d89ad
Comprar asperiores;Item de Compra;1;2023-08-20 06:34:31;;1;A Fazer;Pedro da Silva;f9a533f2c78e4a09f87c9e68e442d3fe
Quibusdam id sit incidunt minus voluptatem corporis expedita iure;Tarefa a Ser Feita;2;2024-02-18 09:22:48;;1;A Fazer;Pedro da Silva;f9a533f2c78e4a09f87c9e68e442d3fe
Comprar nihil;Item de Compra;1;2024-02-22 10:06:03;2024-09-06 10:06:03;2;Concluído;Jeferson Klau;b4853fc1f03a3a4cec530a98a94d89ad
Reprehenderit eligendi provident officia quibusdam;Tarefa a Ser Feita;2;2025-01-05 04:03:18;;1;A Fazer;Jeferson Klau;b4853fc1f03a3a4cec530a98a94d89ad
Eligendi nisi deserunt minus;Tarefa a Ser Feita;2;2024-03-22 00:00:45;;1;A Fazer;Pedro da Silva;f9a533f2c78e4a09f87c9e68e442d3fe
Neque est voluptate error minima;Tarefa a Ser Feita;2;2024-06-04 18:19:56;;3;Cancelado;Jeferson Klau;b4853fc1f03a3a4cec530a98a94d89ad
Comprar voluptate;Item de Compra;1;2025-02-19 16:46:48;;3;Cancelado;Jeferson Klau;b4853fc1f03a3a4cec530a98a94d89ad
Expedita odio dolore est modi;Tarefa a Ser Feita;2;2023-08-08 11:58:14;2024-02-07 11:58:14;2;Concluído;Jeferson Klau;b4853fc1f03a3a4cec530a98a94d89ad
Hic veniam officiis cum;Tarefa a Ser Feita;2;2024-11-19 18:25:40;;1;A Fazer;Jeferson Klau;b4853fc1f03a3a4cec530a98a94d89ad
In deleniti inventore ea nulla;Tarefa a Ser Feita;2;2025-04-07 13:11:44;;3;Cancelado;Pedro da Silva;f9a533f2c78e4a09f87c9e68e442d3fe
At eveniet molestiae;Tarefa a Ser Feita;2;2024-12-21 06:15:41;;3;Cancelado;Pedro da Silva;f9a533f2c78e4a09f87c9e68e442d3fe
Comprar consequuntur;Item de Compra;1;2024-08-08 04:58:18;;3;Cancelado;Jeferson Klau;b4853fc1f03a3a4cec530a98a94d89ad
Qui nobis doloribus hic;Tarefa a Ser Feita;2;2025-05-25 11:19:49;;1;A Fazer;Pedro da Silva;f9a533f2c78e4a09f87c9e68e442d3fe
Magni inventore repellat at delectus quaerat;Tarefa a Ser Feita;2;2023-06-18 13:51:34;;1;A Fazer;Jeferson Klau;b4853fc1f03a3a4cec530a98a94d89ad
Repellat necessitatibus impedit doloribus distinctio minima;Tarefa a Ser Feita;2;2025-01-19 21:30:09;;3;Cancelado;Jeferson Klau;b4853fc1f03a3a4cec530a98a94d89ad
Corporis illo quis dolorum optio;Tarefa a Ser Feita;2;2025-04-10 20:23:02;;3;Cancelado;Jeferson Klau;b4853fc1f03a3a4cec530a98a94d89ad
Qui quam reiciendis consectetur mollitia voluptate saepe provident;Tarefa a Ser Feita;2;2023-12-13 20:06:46;2024-03-29 20:06:46;2;Concluído;Jeferson Klau;b4853fc1f03a3a4cec530a98a94d89ad
Dolorum id in expedita unde;Tarefa a Ser Feita;2;2023-10-17 21:43:27;;1;A Fazer;Pedro da Silva;f9a533f2c78e4a09f87c9e68e442d3fe
Aliquid ipsam necessitatibus error molestiae provident;Tarefa a Ser Feita;2;2024-09-03 11:03:50;;3;Cancelado;Pedro da Silva;f9a533f2c78e4a09f87c9e68e442d3fe
Comprar accusamus;Item de Compra;1;2024-11-15 14:22:18;;3;Cancelado;Jeferson Klau;b4853fc1f03a3a4cec530a98a94d89ad
Comprar ipsum;Item de Compra;1;2025-05-07 06:11:55;2025-06-02 20:53:40;2;Concluído;Pedro da Silva;f9a533f2c78e4a09f87c9e68e442d3fe
Comprar nihil;Item de Compra;1;2024-03-20 03:48:48;;1;A Fazer;Jeferson Klau;b4853fc1f03a3a4cec530a98a94d89ad
Comprar sequi;Item de Compra;1;2024-11-17 13:05:21;;3;Cancelado;Pedro da Silva;f9a533f2c78e4a09f87c9e68e442d3fe
Consectetur nulla voluptate debitis nobis neque;Tarefa a Ser Feita;2;2024-02-18 18:50:09;;3;Cancelado;Jeferson Klau;b4853fc1f03a3a4cec530a98a94d89ad
Repellat vitae dolore ullam;Tarefa a Ser Feita;2;2023-06-22 22:58:41;;1;A Fazer;Jeferson Klau;b4853fc1f03a3a4cec530a98a94d89ad
Comprar similique;Item de Compra;1;2024-10-08 13:17:03;;3;Cancelado;Pedro da Silva;f9a533f2c78e4a09f87c9e68e442d3fe
Maiores deserunt magni nam blanditiis fugit placeat esse;Tarefa a Ser Feita;2;2024-07-20 20:59:41;2024-09-19 20:59:41;2;Concluído;Jeferson Klau;b4853fc1f03a3a4cec530a98a94d89ad
Reiciendis harum id ex;Tarefa a Ser Feita;2;2025-05-13 07:20:08;2025-06-02 20:58:40;2;Concluído;Jeferson Klau;b4853fc1f03a3a4cec530a98a94d89ad
Comprar ducimus;Item de Compra;1;2024-04-02 17:44:15;;1;A Fazer;Pedro da Silva;f9a533f2c78e4a09f87c9e68e442d3fe
Comprar aut;Item de Compra;1;2025-03-28 12:28:44;;3;Cancelado;Jeferson Klau;b4853fc1f03a3a4cec530a98a94d89ad
Et officiis provident dolorem;Tarefa a Ser Feita;2;2024-11-07 04:11:28;2025-05-17 04:11:28;2;Concluído;Pedro da Silva;f9a533f2c78e4a09f87c9e68e442d3fe
Commodi dolorum doloremque repellat optio tenetur;Tarefa a Ser Feita;2;2024-01-29 23:47:54;;3;Cancelado;Pedro da Silva;f9a533f2c78e4a09f87c9e68e442d3fe
Comprar ipsa;Item de Compra;1;2024-07-29 06:45:32;;3;Cancelado;Pedro da Silva;f9a533f2c78e4a09f87c9e68e442d3fe
Labore eligendi;Tarefa a Ser Feita;2;2024-06-29 03:01:17;2025-02-09 03:01:17;2;Concluído;Jeferson Klau;b4853fc1f03a3a4cec530a98a94d89ad
Aut quam rerum reiciendis;Tarefa a Ser Feita;2;2024-08-28 08:04:16;2025-03-23 08:04:16;2;Concluído;Jeferson Klau;b4853fc1f03a3a4cec530a98a94d89ad
Comprar autem;Item de Compra;1;2024-12-09 12:14:34;;3;Cancelado;Jeferson Klau;b4853fc1f03a3a4cec530a98a94d89ad
A iste nulla sunt culpa;Tarefa a Ser Feita;2;2023-08-07 10:45:00;;1;A Fazer;Jeferson Klau;b4853fc1f03a3a4cec530a98a94d89ad
Magnam adipisci quidem inventore earum eligendi quam consequatur;Tarefa a Ser Feita;2;2024-09-30 11:27:12;;3;Cancelado;Jeferson Klau;b4853fc1f03a3a4cec530a98a94d89ad
Comprar neque;Item de Compra;1;2024-10-09 14:33:18;;3;Cancelado;Jeferson Klau;b4853fc1f03a3a4cec530a98a94d89ad
Comprar aspernatur;Item de Compra;1;2023-07-15 02:55:46;;3;Cancelado;Jeferson Klau;b4853fc1f03a3a4cec530a98a94d89ad
Perspiciatis saepe quos quaerat in;Tarefa a Ser Feita;2;2024-07-15 18:56:15;2024-12-15 18:56:15;2;Concluído;Pedro da Silva;f9a533f2c78e4a09f87c9e68e442d3fe
Rem inventore saepe dolores enim nihil neque;Tarefa a Ser Feita;2;2023-07-10 10:46:28;;1;A Fazer;Pedro da Silva;f9a533f2c78e4a09f87c9e68e442d3fe
Comprar vitae;Item de Compra;1;2023-06-17 16:52:51;2024-05-19 16:52:51;2;Concluído;Pedro da Silva;f9a533f2c78e4a09f87c9e68e442d3fe
Comprar omnis;Item de Compra;1;2025-03-19 21:49:56;;1;A Fazer;Jeferson Klau;b4853fc1f03a3a4cec530a98a94d89ad
Comprar nisi;Item de Compra;1;2024-11-15 04:02:52;2025-06-02 21:03:40;2;Concluído;Jeferson Klau;b4853fc1f03a3a4cec530a98a94d89ad
Ipsum voluptatum labore esse sequi nisi;Tarefa a Ser Feita;2;2023-07-05 15:40:37;2024-02-14 15:40:37;2;Concluído;Jeferson Klau;b4853fc1f03a3a4cec530a98a94d89ad
Comprar consequatur;Item de Compra;1;2025-06-02 11:04:30;2025-06-02 21:42:40;2;Concluído;Pedro da Silva;f9a533f2c78e4a09f87c9e68e442d3fe
Vel modi quibusdam;Tarefa a Ser Feita;2;2025-01-14 20:12:00;2025-02-04 20:12:00;2;Concluído;Pedro da Silva;f9a533f2c78e4a09f87c9e68e442d3fe
Libero unde sed blanditiis ea eius;Tarefa a Ser Feita;2;2024-12-29 21:30:26;;3;Cancelado;Pedro da Silva;f9a533f2c78e4a09f87c9e68e442d3fe
Comprar odit;Item de Compra;1;2024-03-26 16:05:35;;1;A Fazer;Pedro da Silva;f9a533f2c78e4a09f87c9e68e442d3fe
Comprar officiis;Item de Compra;1;2023-09-02 14:27:44;2023-12-14 14:27:44;2;Concluído;Jeferson Klau;b4853fc1f03a3a4cec530a98a94d89ad
Delectus recusandae;Tarefa a Ser Feita;2;2024-07-24 14:36:39;;1;A Fazer;Jeferson Klau;b4853fc1f03a3a4cec530a98a94d89ad
Ipsam ipsa a amet;Tarefa a Ser Feita;2;2024-11-11 17:11:06;;3;Cancelado;Jeferson Klau;b4853fc1f03a3a4cec530a98a94d89ad
Ducimus;Tarefa a Ser Feita;2;2023-10-11 15:21:26;;3;Cancelado;Jeferson Klau;b4853fc1f03a3a4cec530a98a94d89ad
Laudantium quod exercitationem libero;Tarefa a Ser Feita;2;2024-04-10 21:33:40;;3;Cancelado;Pedro da Silva;f9a533f2c78e4a09f87c9e68e442d3fe
Comprar necessitatibus;Item de Compra;1;2023-06-12 17:25:31;;3;Cancelado;Pedro da Silva;f9a533f2c78e4a09f87c9e68e442d3fe
Comprar enim;Item de Compra;1;2023-12-25 21:36:04;2023-12-29 21:36:04;2;Concluído;Pedro da Silva;f9a533f2c78e4a09f87c9e68e442d3fe
Comprar incidunt;Item de Compra;1;2024-01-14 19:49:15;;3;Cancelado;Jeferson Klau;b4853fc1f03a3a4cec530a98a94d89ad
Voluptate ullam cumque dolorem;Tarefa a Ser Feita;2;2025-03-26 17:49:29;;1;A Fazer;Pedro da Silva;f9a533f2c78e4a09f87c9e68e442d3fe
Minus minus dignissimos sunt laboriosam;Tarefa a Ser Feita;2;2023-11-18 01:29:14;;1;A Fazer;Jeferson Klau;b4853fc1f03a3a4cec530a98a94d89ad
Minima numquam porro accusantium;Tarefa a Ser Feita;2;2024-01-19 19:04:47;;1;A Fazer;Jeferson Klau;b4853fc1f03a3a4cec530a98a94d89ad
Facilis quaerat numquam fugit eligendi;Tarefa a Ser Feita;2;2024-03-28 11:43:10;;1;A Fazer;Pedro da Silva;f9a533f2c78e4a09f87c9e68e442d3fe
Comprar illum;Item de Compra;1;2024-05-01 16:25:01;2025-01-24 16:25:01;2;Concluído;Jeferson Klau;b4853fc1f03a3a4cec530a98a94d89ad
Corrupti facere a consequatur doloribus eveniet;Tarefa a Ser Feita;2;2025-04-13 16:17:33;;1;A Fazer;Jeferson Klau;b4853fc1f03a3a4cec530a98a94d89ad
Accusamus veniam;Tarefa a Ser Feita;2;2024-12-12 02:39:57;;3;Cancelado;Jeferson Klau;b4853fc1f03a3a4cec530a98a94d89ad
Comprar at;Item de Compra;1;2024-01-21 21:35:43;;3;Cancelado;Pedro da Silva;f9a533f2c78e4a09f87c9e68e442d3fe
Ad doloremque adipisci;Tarefa a Ser Feita;2;2025-05-23 11:47:10;;1;A Fazer;Jeferson Klau;b4853fc1f03a3a4cec530a98a94d89ad
Comprar totam;Item de Compra;1;2023-08-12 11:33:31;;1;A Fazer;Pedro da Silva;f9a533f2c78e4a09f87c9e68e442d3fe
Distinctio eveniet sint numquam assumenda;Tarefa a Ser Feita;2;2024-08-10 16:51:28;;3;Cancelado;Jeferson Klau;b4853fc1f03a3a4cec530a98a94d89ad
Comprar facere;Item de Compra;1;2025-01-10 02:39:20;2025-06-02 21:29:40;2;Concluído;Jeferson Klau;b4853fc1f03a3a4cec530a98a94d89ad
Accusantium a unde magnam;Tarefa a Ser Feita;2;2024-07-07 13:58:34;;1;A Fazer;Pedro da Silva;f9a533f2c78e4a09f87c9e68e442d3fe
Ducimus ipsum voluptatum magnam;Tarefa a Ser Feita;2;2024-10-19 19:59:08;2025-06-02 21:14:40;2;Concluído;Pedro da Silva;f9a533f2c78e4a09f87c9e68e442d3fe
Saepe possimus quis a;Tarefa a Ser Feita;2;2023-06-03 15:30:49;;1;A Fazer;Jeferson Klau;b4853fc1f03a3a4cec530a98a94d89ad
Ipsa nulla;Tarefa a Ser Feita;2;2023-06-25 22:57:08;2024-02-06 22:57:08;2;Concluído;Jeferson Klau;b4853fc1f03a3a4cec530a98a94d89ad
Aperiam dolorum tempora aliquam asperiores corporis laudantium;Tarefa a Ser Feita;2;2024-06-26 10:37:45;;1;A Fazer;Pedro da Silva;f9a533f2c78e4a09f87c9e68e442d3fe
Alias vero ullam;Tarefa a Ser Feita;2;2024-11-06 01:09:46;;3;Cancelado;Pedro da Silva;f9a533f2c78e4a09f87c9e68e442d3fe
Fugiat cumque tempore fugiat;Tarefa a Ser Feita;2;2025-05-18 02:47:27;;3;Cancelado;Jeferson Klau;b4853fc1f03a3a4cec530a98a94d89ad
Comprar tempore;Item de Compra;1;2025-02-03 11:53:01;;1;A Fazer;Jeferson Klau;b4853fc1f03a3a4cec530a98a94d89ad
Comprar repellendus;Item de Compra;1;2024-09-12 20:25:56;;3;Cancelado;Pedro da Silva;f9a533f2c78e4a09f87c9e68e442d3fe
Comprar nulla;Item de Compra;1;2023-07-08 22:56:27;2024-04-23 22:56:27;2;Concluído;Pedro da Silva;f9a533f2c78e4a09f87c9e68e442d3fe
Explicabo est dolore occaecati;Tarefa a Ser Feita;2;2024-10-30 20:14:24;2025-01-29 20:14:24;2;Concluído;Jeferson Klau;b4853fc1f03a3a4cec530a98a94d89ad
Deserunt numquam placeat;Tarefa a Ser Feita;2;2025-01-25 14:13:00;;3;Cancelado;Pedro da Silva;f9a533f2c78e4a09f87c9e68e442d3fe
Comprar dolor;Item de Compra;1;2025-02-03 05:13:40;;1;A Fazer;Pedro da Silva;f9a533f2c78e4a09f87c9e68e442d3fe
Comprar dolores;Item de Compra;1;2023-09-01 17:06:51;2024-08-25 17:06:51;2;Concluído;Pedro da Silva;f9a533f2c78e4a09f87c9e68e442d3fe
Comprar dolorum;Item de Compra;1;2024-11-03 21:07:01;;1;A Fazer;Jeferson Klau;b4853fc1f03a3a4cec530a98a94d89ad
Itaque expedita saepe quod aspernatur omnis temporibus quis;Tarefa a Ser Feita;2;2023-06-09 17:13:27;;1;A Fazer;Jeferson Klau;b4853fc1f03a3a4cec530a98a94d89ad
Assumenda molestias amet;Tarefa a Ser Feita;2;2025-03-10 15:19:42;2025-06-02 21:06:40;2;Concluído;Jeferson Klau;b4853fc1f03a3a4cec530a98a94d89ad
Laboriosam architecto architecto fugiat iure;Tarefa a Ser Feita;2;2024-03-31 05:37:57;;3;Cancelado;Jeferson Klau;b4853fc1f03a3a4cec530a98a94d89ad
Occaecati explicabo quis officiis quae quasi rem;Tarefa a Ser Feita;2;2023-09-09 03:46:44;2024-04-08 03:46:44;2;Concluído;Pedro da Silva;f9a533f2c78e4a09f87c9e68e442d3fe
Enim perferendis unde similique consequuntur explicabo repudiandae;Tarefa a Ser Feita;2;2023-12-03 11:45:32;2024-08-06 11:45:32;2;Concluído;Pedro da Silva;f9a533f2c78e4a09f87c9e68e442d3fe
Incidunt et nam laborum;Tarefa a Ser Feita;2;2023-06-06 10:27:22;;3;Cancelado;Jeferson Klau;b4853fc1f03a3a4cec530a98a94d89ad
Tempore quibusdam vel;Tarefa a Ser Feita;2;2024-08-11 13:29:43;;1;A Fazer;Pedro da Silva;f9a533f2c78e4a09f87c9e68e442d3fe
Officia cum reprehenderit;Tarefa a Ser Feita;2;2024-04-02 20:59:29;;1;A Fazer;Pedro da Silva;f9a533f2c78e4a09f87c9e68e442d3fe
Placeat sapiente mollitia et;Tarefa a Ser Feita;2;2024-07-18 19:43:11;;3;Cancelado;Pedro da Silva;f9a533f2c78e4a09f87c9e68e442d3fe
Comprar eos;Item de Compra;1;2024-01-06 03:55:02;2024-02-15 03:55:02;2;Concluído;Jeferson Klau;b4853fc1f03a3a4cec530a98a94d89ad
Nemo ea facere veniam;Tarefa a Ser Feita;2;2025-03-31 05:15:24;;1;A Fazer;Jeferson Klau;b4853fc1f03a3a4cec530a98a94d89ad
Et vero non rerum esse dolore quod;Tarefa a Ser Feita;2;2023-10-31 01:13:35;2024-01-26 01:13:35;2;Concluído;Pedro da Silva;f9a533f2c78e4a09f87c9e68e442d3fe
Recusandae earum quis pariatur;Tarefa a Ser Feita;2;2025-01-10 23:26:31;2025-05-02 23:26:31;2;Concluído;Pedro da Silva;f9a533f2c78e4a09f87c9e68e442d3fe
At ratione sed dolorem;Tarefa a Ser Feita;2;2024-01-19 06:13:23;;3;Cancelado;Pedro da Silva;f9a533f2c78e4a09f87c9e68e442d3fe
Molestiae odit tempora asperiores;Tarefa a Ser Feita;2;2024-12-22 17:42:39;;3;Cancelado;Jeferson Klau;b4853fc1f03a3a4cec530a98a94d89ad
Comprar labore;Item de Compra;1;2024-10-21 07:48:55;;1;A Fazer;Pedro da Silva;f9a533f2c78e4a09f87c9e68e442d3fe
Doloremque libero praesentium;Tarefa a Ser Feita;2;2023-06-25 03:34:35;;1;A Fazer;Pedro da Silva;f9a533f2c78e4a09f87c9e68e442d3fe
Quam dolore;Tarefa a Ser Feita;2;2024-06-02 04:03:06;;1;A Fazer;Jeferson Klau;b4853fc1f03a3a4cec530a98a94d89ad
Nesciunt veniam molestias;Tarefa a Ser Feita;2;2024-01-16 11:12:01;2024-01-29 11:12:01;2;Concluído;Pedro da Silva;f9a533f2c78e4a09f87c9e68e442d3fe
Consectetur nostrum aliquid odio quam accusamus nobis cupiditate repellendus;Tarefa a Ser Feita;2;2024-07-31 16:27:24;;1;A Fazer;Jeferson Klau;b4853fc1f03a3a4cec530a98a94d89ad
Comprar iure;Item de Compra;1;2023-11-22 02:30:38;;1;A Fazer;Pedro da Silva;f9a533f2c78e4a09f87c9e68e442d3fe
Veniam quae nesciunt;Tarefa a Ser Feita;2;2024-04-04 23:31:47;;3;Cancelado;Jeferson Klau;b4853fc1f03a3a4cec530a98a94d89ad
Aut eum suscipit nisi modi iure;Tarefa a Ser Feita;2;2023-06-29 01:09:59;;1;A Fazer;Jeferson Klau;b4853fc1f03a3a4cec530a98a94d89ad
Nisi quam sint beatae porro eos omnis quibusdam asperiores;Tarefa a Ser Feita;2;2024-02-06 15:09:27;;1;A Fazer;Jeferson Klau;b4853fc1f03a3a4cec530a98a94d89ad
Comprar doloremque;Item de Compra;1;2025-05-16 09:34:55;;3;Cancelado;Pedro da Silva;f9a533f2c78e4a09f87c9e68e442d3fe
Nemo id natus;Tarefa a Ser Feita;2;2023-10-13 05:44:43;;3;Cancelado;Pedro da Silva;f9a533f2c78e4a09f87c9e68e442d3fe
Comprar rerum;Item de Compra;1;2024-10-13 02:33:31;2025-06-02 21:42:40;2;Concluído;Jeferson Klau;b4853fc1f03a3a4cec530a98a94d89ad
Eveniet amet voluptatibus libero ipsum praesentium;Tarefa a Ser Feita;2;2025-04-01 02:26:49;;3;Cancelado;Jeferson Klau;b4853fc1f03a3a4cec530a98a94d89ad
Comprar fugit;Item de Compra;1;2024-03-04 00:44:29;;3;Cancelado;Pedro da Silva;f9a533f2c78e4a09f87c9e68e442d3fe
Dolores quis doloremque;Tarefa a Ser Feita;2;2023-09-02 15:39:33;;3;Cancelado;Jeferson Klau;b4853fc1f03a3a4cec530a98a94d89ad
Reprehenderit hic illum repellendus impedit reiciendis facere;Tarefa a Ser Feita;2;2025-05-13 00:26:04;2025-06-02 20:52:40;2;Concluído;Pedro da Silva;f9a533f2c78e4a09f87c9e68e442d3fe
Comprar similique;Item de Compra;1;2024-07-16 22:12:48;2025-04-18 22:12:48;2;Concluído;Jeferson Klau;b4853fc1f03a3a4cec530a98a94d89ad
Comprar delectus;Item de Compra;1;2023-12-26 16:14:44;;3;Cancelado;Jeferson Klau;b4853fc1f03a3a4cec530a98a94d89ad
Comprar odio;Item de Compra;1;2024-01-04 16:15:34;2024-10-20 16:15:34;2;Concluído;Pedro da Silva;f9a533f2c78e4a09f87c9e68e442d3fe
Excepturi culpa vero delectus incidunt velit voluptates;Tarefa a Ser Feita;2;2024-06-14 18:25:00;;1;A Fazer;Pedro da Silva;f9a533f2c78e4a09f87c9e68e442d3fe
Ea laboriosam soluta;Tarefa a Ser Feita;2;2024-04-06 03:38:58;;3;Cancelado;Pedro da Silva;f9a533f2c78e4a09f87c9e68e442d3fe
Quas recusandae omnis quos quibusdam ex;Tarefa a Ser Feita;2;2025-03-17 12:18:39;;3;Cancelado;Pedro da Silva;f9a533f2c78e4a09f87c9e68e442d3fe
Aspernatur illum;Tarefa a Ser Feita;2;2023-09-20 10:18:14;;1;A Fazer;Jeferson Klau;b4853fc1f03a3a4cec530a98a94d89ad
Perspiciatis enim illo labore fuga;Tarefa a Ser Feita;2;2024-05-11 20:08:04;;3;Cancelado;Jeferson Klau;b4853fc1f03a3a4cec530a98a94d89ad
Sed similique quos corporis;Tarefa a Ser Feita;2;2024-11-30 08:29:35;;3;Cancelado;Pedro da Silva;f9a533f2c78e4a09f87c9e68e442d3fe
Consequatur veritatis blanditiis;Tarefa a Ser Feita;2;2024-09-06 01:43:48;2024-11-10 01:43:48;2;Concluído;Jeferson Klau;b4853fc1f03a3a4cec530a98a94d89ad
Fuga et reiciendis;Tarefa a Ser Feita;2;2024-03-16 09:20:56;;3;Cancelado;Jeferson Klau;b4853fc1f03a3a4cec530a98a94d89ad
Comprar voluptatum;Item de Compra;1;2024-03-12 19:25:15;2024-11-07 19:25:15;2;Concluído;Jeferson Klau;b4853fc1f03a3a4cec530a98a94d89ad
Comprar autem;Item de Compra;1;2024-08-30 16:10:52;;3;Cancelado;Jeferson Klau;b4853fc1f03a3a4cec530a98a94d89ad
Comprar expedita;Item de Compra;1;2024-01-21 21:02:20;;3;Cancelado;Jeferson Klau;b4853fc1f03a3a4cec530a98a94d89ad
Ipsa dolor id;Tarefa a Ser Feita;2;2024-08-16 14:53:43;;3;Cancelado;Pedro da Silva;f9a533f2c78e4a09f87c9e68e442d3fe
Aut dicta voluptatem illum modi eligendi repellendus;Tarefa a Ser Feita;2;2023-11-07 10:01:18;2024-06-21 10:01:18;2;Concluído;Pedro da Silva;f9a533f2c78e4a09f87c9e68e442d3fe
Doloribus nobis odit quam temporibus ab;Tarefa a Ser Feita;2;2024-10-06 21:19:16;;3;Cancelado;Pedro da Silva;f9a533f2c78e4a09f87c9e68e442d3fe
Aspernatur inventore harum officiis harum molestiae rem molestiae sequi;Tarefa a Ser Feita;2;2023-11-09 20:24:14;;1;A Fazer;Pedro da Silva;f9a533f2c78e4a09f87c9e68e442d3fe
Vero dicta repellat illum vel;Tarefa a Ser Feita;2;2024-04-16 12:41:25;2024-12-01 12:41:25;2;Concluído;Jeferson Klau;b4853fc1f03a3a4cec530a98a94d89ad
Comprar doloribus;Item de Compra;1;2025-03-20 17:10:14;;1;A Fazer;Jeferson Klau;b4853fc1f03a3a4cec530a98a94d89ad
Nemo atque iste sit perspiciatis necessitatibus sunt;Tarefa a Ser Feita;2;2024-09-21 21:48:34;2025-05-23 21:48:34;2;Concluído;Jeferson Klau;b4853fc1f03a3a4cec530a98a94d89ad
Comprar ipsum;Item de Compra;1;2024-10-03 23:33:37;;3;Cancelado;Pedro da Silva;f9a533f2c78e4a09f87c9e68e442d3fe
Comprar dolorum;Item de Compra;1;2024-05-10 02:17:54;;3;Cancelado;Jeferson Klau;b4853fc1f03a3a4cec530a98a94d89ad
Comprar mollitia;Item de Compra;1;2024-02-07 21:14:51;2024-05-08 21:14:51;2;Concluído;Pedro da Silva;f9a533f2c78e4a09f87c9e68e442d3fe
Blanditiis quo ut distinctio;Tarefa a Ser Feita;2;2024-07-06 12:20:15;2024-11-24 12:20:15;2;Concluído;Pedro da Silva;f9a533f2c78e4a09f87c9e68e442d3fe
Inventore deleniti;Tarefa a Ser Feita;2;2025-05-14 00:31:36;;1;A Fazer;Jeferson Klau;b4853fc1f03a3a4cec530a98a94d89ad
Comprar quos;Item de Compra;1;2024-09-10 21:13:03;2025-01-26 21:13:03;2;Concluído;Jeferson Klau;b4853fc1f03a3a4cec530a98a94d89ad
Explicabo facere repellendus accusantium odio sunt nihil;Tarefa a Ser Feita;2;2024-11-23 04:48:01;2025-03-26 04:48:01;2;Concluído;Pedro da Silva;f9a533f2c78e4a09f87c9e68e442d3fe
Id facilis expedita totam molestiae veritatis;Tarefa a Ser Feita;2;2025-02-06 21:26:12;;1;A Fazer;Pedro da Silva;f9a533f2c78e4a09f87c9e68e442d3fe
Minima vel laboriosam ea dignissimos soluta hic asperiores;Tarefa a Ser Feita;2;2025-02-04 06:25:06;;3;Cancelado;Pedro da Silva;f9a533f2c78e4a09f87c9e68e442d3fe
Dignissimos eligendi voluptate corrupti;Tarefa a Ser Feita;2;2023-12-01 13:03:21;2024-04-28 13:03:21;2;Concluído;Jeferson Klau;b4853fc1f03a3a4cec530a98a94d89ad
Earum veniam facilis;Tarefa a Ser Feita;2;2023-10-16 03:50:23;;3;Cancelado;Jeferson Klau;b4853fc1f03a3a4cec530a98a94d89ad
Vero itaque qui enim perspiciatis autem laborum soluta;Tarefa a Ser Feita;2;2024-02-02 00:54:12;2024-06-22 00:54:12;2;Concluído;Pedro da Silva;f9a533f2c78e4a09f87c9e68e442d3fe
Distinctio eos repellat ullam;Tarefa a Ser Feita;2;2024-09-19 04:04:09;;3;Cancelado;Pedro da Silva;f9a533f2c78e4a09f87c9e68e442d3fe
Numquam nam;Tarefa a Ser Feita;2;2024-07-08 02:17:55;;3;Cancelado;Pedro da Silva;f9a533f2c78e4a09f87c9e68e442d3fe
Comprar praesentium;Item de Compra;1;2024-01-22 21:55:37;2025-01-20 21:55:37;2;Concluído;Jeferson Klau;b4853fc1f03a3a4cec530a98a94d89ad
Repellat facere unde;Tarefa a Ser Feita;2;2023-12-21 11:05:31;;1;A Fazer;Jeferson Klau;b4853fc1f03a3a4cec530a98a94d89ad
Nulla nostrum;Tarefa a Ser Feita;2;2025-03-06 20:36:11;2025-06-02 21:19:40;2;Concluído;Pedro da Silva;f9a533f2c78e4a09f87c9e68e442d3fe
Officiis vero dolorem recusandae ipsum est nulla;Tarefa a Ser Feita;2;2025-05-04 04:28:38;2025-06-02 21:21:40;2;Concluído;Jeferson Klau;b4853fc1f03a3a4cec530a98a94d89ad
Comprar voluptatem;Item de Compra;1;2024-07-30 20:13:48;;3;Cancelado;Pedro da Silva;f9a533f2c78e4a09f87c9e68e442d3fe
Itaque cupiditate perferendis eius;Tarefa a Ser Feita;2;2024-10-25 08:31:01;;1;A Fazer;Jeferson Klau;b4853fc1f03a3a4cec530a98a94d89ad
Placeat magni alias similique dolorum minima suscipit asperiores;Tarefa a Ser Feita;2;2023-12-19 23:03:29;;3;Cancelado;Jeferson Klau;b4853fc1f03a3a4cec530a98a94d89ad
Comprar rerum;Item de Compra;1;2024-12-07 23:21:45;2025-01-13 23:21:45;2;Concluído;Pedro da Silva;f9a533f2c78e4a09f87c9e68e442d3fe
