Perspiciatis assumenda totam esse eum rem;Tarefa a Ser Feita;2;2023-08-05 20:20:21;;3;Cancelado;Jeferson Klau;b4853fc1f03a3a4cec530a98a94d89ad
Perferendis sequi;Tarefa a Ser Feita;2;2023-07-16 17:14:05;;1;A Fazer;Pedro da Silva;f9a533f2c78e4a09f87c9e68e442d3fe
Temporibus nemo aliquid;Tarefa a Ser Feita;2;2024-12-26 03:31:55;2025-03-18 03:31:55;2;Concluído;Pedro da Silva;f9a533f2c78e4a09f87c9e68e442d3fe
Comprar maiores;Item de Compra;1;2024-04-05 14:16:13;;3;Cancelado;Jeferson Klau;b4853fc1f03a3a4cec530a98a94d89ad
Comprar sapiente;Item de Compra;1;2025-03-30 23:17:40;;3;Cancelado;Pedro da Silva;f9a533f2c78e4a09f87c9e68e442d3fe
Comprar aliquam;Item de Compra;1;2023-07-01 13:26:53;2024-06-20 13:26:53;2;Concluído;Pedro da Silva;f9a533f2c78e4a09f87c9e68e442d3fe
Hic inventore ab fugit doloribus esse quibusdam;Tarefa a Ser Feita;2;2024-06-16 17:47:29;2025-01-22 17:47:29;2;Concluído;Jeferson Klau;b4853fc1f03a3a4cec530a98a94d89ad
Reiciendis perspiciatis distinctio consequuntur delectus;Tarefa a Ser Feita;2;2025-03-24 11:34:56;;3;Cancelado;Pedro da Silva;f9a533f2c78e4a09f87c9e68e442d3fe
Comprar autem;Item de Compra;1;2025-03-27 11:00:24;;3;Cancelado;Pedro da Silva;f9a533f2c78e4a09f87c9e68e442d3fe
Comprar aut;Item de Compra;1;2023-10-05 00:58:28;;1;A Fazer;Jeferson Klau;b4853fc1f03a3a4cec530a98a94d89ad
Natus ipsam sunt eos saepe eum saepe eius doloremque;Tarefa a Ser Feita;2;2024-09-04 01:24:21;;1;A Fazer;Jeferson Klau;b4853fc1f03a3a4cec530a98a94d89ad
Libero aperiam consequatur non;Tarefa a Ser Feita;2;2023-09-27 13:27:37;;1;A Fazer;Jeferson Klau;b4853fc1f03a3a4cec530a98a94d89ad
Comprar veniam;Item de Compra;1;2023-07-13 04:31:50;;3;Cancelado;Pedro da Silva;f9a533f2c78e4a09f87c9e68e442d3fe
Vel deserunt reprehenderit assumenda recusandae dicta quas;Tarefa a Ser Feita;2;2023-10-15 15:37:11;;1;A Fazer;Pedro da Silva;f9a533f2c78e4a09f87c9e68e442d3fe
Eveniet beatae suscipit itaque asperiores dignissimos;Tarefa a Ser Feita;2;2025-04-24 08:22:46;;1;A Fazer;Pedro da Silva;f9a533f2c78e4a09f87c9e68e442d3fe
Comprar voluptatibus;Item de Compra;1;2024-03-16 03:18:12;2025-02-01 03:18:12;2;Concluído;Pedro da Silva;f9a533f2c78e4a09f87c9e68e442d3fe
Comprar quidem;Item de Compra;1;2023-11-28 08:36:49;;1;A Fazer;Pedro da Silva;f9a533f2c78e4a09f87c9e68e442d3fe
Quidem id optio earum vitae unde quis incidunt;Tarefa a Ser Feita;2;2024-02-14 08:09:05;;3;Cancelado;Pedro da Silva;f9a533f2c78e4a09f87c9e68e442d3fe
Doloribus provident ipsum cumque aspernatur;Tarefa a Ser Feita;2;2025-02-08 07:39:22;;1;A Fazer;Jeferson Klau;b4853fc1f03a3a4cec530a98a94d89ad
Laborum esse illo maxime inventore sunt;Tarefa a Ser Feita;2;2023-11-26 10:56:56;;3;Cancelado;Jeferson Klau;b4853fc1f03a3a4cec530a98a94d89ad
Laboriosam odit vitae voluptate vero corporis eaque labore;Tarefa a Ser Feita;2;2024-06-19 06:43:35;;1;A Fazer;Jeferson Klau;b4853fc1f03a3a4cec530a98a94d89ad
Dolores nostrum repellat at ipsum provident laudantium;Tarefa a Ser Feita;2;2024-12-31 13:12:50;2025-06-02 21:38:40;2;Concluído;Jeferson Klau;b4853fc1f03a3a4cec530a98a94d89ad
Comprar quaerat;Item de Compra;1;2025-05-06 20:28:28;;1;A Fazer;Jeferson Klau;b4853fc1f03a3a4cec530a98a94d89ad
Comprar sit;Item de Compra;1;2024-07-31 17:28:39;;1;A Fazer;Jeferson Klau;b4853fc1f03a3a4cec530a98a94d89ad
Quas pariatur;Tarefa a Ser Feita;2;2023-09-13 05:25:23;;3;Cancelado;Jeferson Klau;b4853fc1f03a3a4cec530a98a94d89ad
Distinctio totam officia;Tarefa a Ser Feita;2;2024-08-08 08:12:38;2025-03-14 08:12:38;2;Concluído;Jeferson Klau;b4853fc1f03a3a4cec530a98a94d89ad
Comprar quis;Item de Compra;1;2024-12-30 02:53:37;2025-06-02 21:42:40;2;Concluído;Jeferson Klau;b4853fc1f03a3a4cec530a98a94d89ad
Voluptatum corrupti iure illo cupiditate;Tarefa a Ser Feita;2;2025-03-25 13:08:18;2025-06-02 21:02:40;2;Concluído;Jeferson Klau;b4853fc1f03a3a4cec530a98a94d89ad
Aperiam quod sit dignissimos perspiciatis voluptate nobis;Tarefa a Ser Feita;2;2023-08-15 13:59:21;;3;Cancelado;Jeferson Klau;b4853fc1f03a3a4cec530a98a94d89ad
Quis qui molestias culpa ipsum ipsam inventore;Tarefa a Ser Feita;2;2023-07-07 01:56:19;;1;A Fazer;Jeferson Klau;b4853fc1f03a3a4cec530a98a94d89ad
Consectetur non ipsum;Tarefa a Ser Feita;2;2024-12-11 13:16:58;;3;Cancelado;Jeferson Klau;b4853fc1f03a3a4cec530a98a94d89ad
Ipsam natus corporis enim voluptate fugit consectetur illo;Tarefa a Ser Feita;2;2024-10-01 22:42:46;;1;A Fazer;Pedro da Silva;f9a533f2c78e4a09f87c9e68e442d3fe
Comprar non;Item de Compra;1;2024-02-24 16:30:28;2024-11-11 16:30:28;2;Concluído;Jeferson Klau;b4853fc1f03a3a4cec530a98a94d89ad
Incidunt eligendi blanditiis;Tarefa a Ser Feita;2;2023-08-02 10:07:37;;1;A Fazer;Pedro da Silva;f9a533f2c78e4a09f87c9e68e442d3fe
Comprar laborum;Item de Compra;1;2024-05-10 11:37:18;2025-01-12 11:37:18;2;Concluído;Pedro da Silva;f9a533f2c78e4a09f87c9e68e442d3fe
Comprar iste;Item de Compra;1;2024-10-26 15:33:36;2024-12-09 15:33:36;2;Concluído;Jeferson Klau;b4853fc1f03a3a4cec530a98a94d89ad
Reiciendis ex in aliquid error;Tarefa a Ser Feita;2;2023-06-05 00:50:07;;3;Cancelado;Pedro da Silva;f9a533f2c78e4a09f87c9e68e442d3fe
Nostrum alias amet;Tarefa a Ser Feita;2;2024-05-24 00:51:39;2025-04-05 00:51:39;2;Concluído;Jeferson Klau;b4853fc1f03a3a4cec530a98a94d89ad
Comprar provident;Item de Compra;1;2024-04-25 15:01:59;2025-01-06 15:01:59;2;Concluído;Jeferson Klau;b4853fc1f03a3a4cec530a98a94d89ad
Dolores beatae;Tarefa a Ser Feita;2;2023-07-23 04:17:08;;1;A Fazer;Jeferson Klau;b4853fc1f03a3a4cec530a98a94d89ad
Comprar maxime;Item de Compra;1;2024-04-16 09:06:37;;3;Cancelado;Pedro da Silva;f9a533f2c78e4a09f87c9e68e442d3fe
Maxime cupiditate voluptatem aliquid;Tarefa a Ser Feita;2;2024-11-02 23:04:15;;3;Cancelado;Jeferson Klau;b4853fc1f03a3a4cec530a98a94d89ad
Neque alias fugiat amet officiis odit;Tarefa a Ser Feita;2;2025-01-15 12:28:06;2025-03-18 12:28:06;2;Concluído;Jeferson Klau;b4853fc1f03a3a4cec530a98a94d89ad
Perspiciatis repellat sint;Tarefa a Ser Feita;2;2024-10-08 09:40:54;;3;Cancelado;Jeferson Klau;b4853fc1f03a3a4cec530a98a94d89ad
Expedita praesentium nulla esse accusantium corrupti;Tarefa a Ser Feita;2;2023-09-16 00:45:32;;1;A Fazer;Pedro da Silva;f9a533f2c78e4a09f87c9e68e442d3fe
Comprar natus;Item de Compra;1;2025-04-29 04:51:56;;1;A Fazer;Jeferson Klau;b4853fc1f03a3a4cec530a98a94d89ad
Impedit omnis repellendus quod;Tarefa a Ser Feita;2;2023-08-26 12:56:42;2024-03-10 12:56:42;2;Concluído;Pedro da Silva;f9a533f2c78e4a09f87c9e68e442d3fe
Quo nesciunt veritatis officiis;Tarefa a Ser Feita;2;2024-08-03 02:40:00;2025-06-02 21:30:40;2;Concluído;Jeferson Klau;b4853fc1f03a3a4cec530a98a94d89ad
Libero facere fuga minus corrupti;Tarefa a Ser Feita;2;2023-07-27 18:10:13;2024-01-29 18:10:13;2;Concluído;Pedro da Silva;f9a533f2c78e4a09f87c9e68e442d3fe
Comprar adipisci;Item de Compra;1;2023-11-23 07:50:10;2024-05-09 07:50:10;2;Concluído;Pedro da Silva;f9a533f2c78e4a09f87c9e68e442d3fe
Aperiam sapiente voluptates ratione;Tarefa a Ser Feita;2;2023-07-06 22:23:58;2024-02-03 22:23:58;2;Concluído;Pedro da Silva;f9a533f2c78e4a09f87c9e68e442d3fe
Comprar dignissimos;Item de Compra;1;2025-01-02 10:05:23;2025-03-10 10:05:23;2;Concluído;Jeferson Klau;b4853fc1f03a3a4cec530a98a94d89ad
Atque voluptatibus quas animi natus ipsam corrupti natus;Tarefa a Ser Feita;2;2025-02-10 14:11:59;;1;A Fazer;Jeferson Klau;b4853fc1f03a3a4cec530a98a94d89ad
Occaecati aut beatae facere iure;Tarefa a Ser Feita;2;2024-04-23 09:16:01;;3;Cancelado;Jeferson Klau;b4853fc1f03a3a4cec530a98a94d89ad
Comprar eos;Item de Compra;1;2025-05-31 11:08:56;2025-06-02 20:55:40;2;Concluído;Pedro da Silva;f9a533f2c78e4a09f87c9e68e442d3fe
Dolorum temporibus eaque sequi;Tarefa a Ser Feita;2;2023-12-29 02:15:37;;3;Cancelado;Jeferson Klau;b4853fc1f03a3a4cec530a98a94d89ad
Comprar explicabo;Item de Compra;1;2024-09-22 13:49:15;;3;Cancelado;Pedro da Silva;f9a533f2c78e4a09f87c9e68e442d3fe
Comprar rem;Item de Compra;1;2025-01-14 20:54:18;;1;A Fazer;Pedro da Silva;f9a533f2c78e4a09f87c9e68e442d3fe
Accusantium rerum corrupti adipisci eligendi quisquam distinctio;Tarefa a Ser Feita;2;2023-12-07 10:06:05;;3;Cancelado;Jeferson Klau;b4853fc1f03a3a4cec530a98a94d89ad
Dolore aperiam laboriosam fugit repellat;Tarefa a Ser Feita;2;2024-05-28 01:22:22;;3;Cancelado;Jeferson Klau;b4853fc1f03a3a4cec530a98a94d89ad
Quae totam ipsa deleniti porro;Tarefa a Ser Feita;2;2024-04-10 08:45:54;;3;Cancelado;Pedro da Silva;f9a533f2c78e4a09f87c9e68e442d3fe
Comprar deserunt;Item de Compra;1;2025-05-09 19:46:08;;3;Cancelado;Jeferson Klau;b4853fc1f03a3a4cec530a98a94d89ad
Ad porro vero adipisci architecto quae explicabo;Tarefa a Ser Feita;2;2024-06-28 22:39:50;;1;A Fazer;Pedro da Silva;f9a533f2c78e4a09f87c9e68e442d3fe
Atque incidunt accusamus;Tarefa a Ser Feita;2;2025-02-15 23:34:28;;1;A Fazer;Pedro da Silva;f9a533f2c78e4a09f87c9e68e442d3fe
Aliquam aliquid aut qui hic repellendus;Tarefa a Ser Feita;2;2024-11-06 22:52:20;;3;Cancelado;Pedro da Silva;f9a533f2c78e4a09f87c9e68e442d3fe
Ducimus dolor quo;Tarefa a Ser Feita;2;2023-06-15 12:02:44;2024-03-04 12:02:44;2;Concluído;Jeferson Klau;b4853fc1f03a3a4cec530a98a94d89ad
Repellendus ducimus vero;Tarefa a Ser Feita;2;2025-03-13 14:32:17;;3;Cancelado;Jeferson Klau;b4853fc1f03a3a4cec530a98a94d89ad
Consequuntur non quaerat nisi;Tarefa a Ser Feita;2;2023-09-23 03:50:35;2023-11-02 03:50:35;2;Concluído;Jeferson Klau;b4853fc1f03a3a4cec530a98a94d89ad
Comprar veritatis;Item de Compra;1;2024-11-01 20:29:40;;3;Cancelado;Pedro da Silva;f9a533f2c78e4a09f87c9e68e442d3fe
Consequatur esse tenetur;Tarefa a Ser Feita;2;2023-06-26 19:57:13;;1;A Fazer;Jeferson Klau;b4853fc1f03a3a4cec530a98a94d89ad
Optio incidunt quibusdam;Tarefa a Ser Feita;2;2023-12-10 06:20:33;;1;A Fazer;Jeferson Klau;b4853fc1f03a3a4cec530a98a94d89ad
Voluptas quaerat reiciendis;Tarefa a Ser Feita;2;2023-12-22 01:32:19;;3;Cancelado;Pedro da Silva;f9a533f2c78e4a09f87c9e68e442d3fe
Comprar libero;Item de Compra;1;2024-01-08 17:13:01;;1;A Fazer;Pedro da Silva;f9a533f2c78e4a09f87c9e68e442d3fe
Magnam;Tarefa a Ser Feita;2;2024-05-28 08:33:15;2024-10-11 08:33:15;2;Concluído;Pedro da Silva;f9a533f2c78e4a09f87c9e68e442d3fe
Comprar amet;Item de Compra;1;2024-02-05 03:13:42;;1;A Fazer;Jeferson Klau;b4853fc1f03a3a4cec530a98a94d89ad
Comprar deleniti;Item de Compra;1;2024-10-14 09:37:57;;3;Cancelado;Pedro da Silva;f9a533f2c78e4a09f87c9e68e442d3fe
Comprar delectus;Item de Compra;1;2023-09-28 13:44:28;;1;A Fazer;Jeferson Klau;b4853fc1f03a3a4cec530a98a94d89ad
Comprar pariatur;Item de Compra;1;2024-02-23 23:36:12;;1;A Fazer;Pedro da Silva;f9a533f2c78e4a09f87c9e68e442d3fe
Accusantium quidem eius id id;Tarefa a Ser Feita;2;2024-12-29 20:26:09;;1;A Fazer;Jeferson Klau;b4853fc1f03a3a4cec530a98a94d89ad
Comprar unde;Item de Compra;1;2024-10-08 03:19:58;;3;Cancelado;Jeferson Klau;b4853fc1f03a3a4cec530a98a94d89ad
Comprar itaque;Item de Compra;1;2024-01-05 07:34:02;2024-10-19 07:34:02;2;Concluído;Pedro da Silva;f9a533f2c78e4a09f87c9e68e442d3fe
Voluptatum debitis;Tarefa a Ser Feita;2;2024-02-06 18:54:16;;3;Cancelado;Jeferson Klau;b4853fc1f03a3a4cec530a98a94d89ad
Occaecati laudantium nesciunt corporis;Tarefa a Ser Feita;2;2023-10-23 09:16:43;2023-10-31 09:16:43;2;Concluído;Jeferson Klau;b4853fc1f03a3a4cec530a98a94d89ad
Asperiores necessitatibus a;Tarefa a Ser Feita;2;2024-02-24 10:32:18;;3;Cancelado;Pedro da Silva;f9a533f2c78e4a09f87c9e68e442d3fe
Tempore ad laudantium autem voluptas eos adipisci;Tarefa a Ser Feita;2;2025-04-22 16:30:25;2025-06-02 20:58:40;2;Concluído;Jeferson Klau;b4853fc1f03a3a4cec530a98a94d89ad
Comprar corporis;Item de Compra;1;2023-12-17 10:59:01;2024-05-28 10:59:01;2;Concluído;Pedro da Silva;f9a533f2c78e4a09f87c9e68e442d3fe
Doloremque rem soluta hic;Tarefa a Ser Feita;2;2024-01-29 23:40:15;;1;A Fazer;Pedro da Silva;f9a533f2c78e4a09f87c9e68e442d3fe
Comprar at;Item de Compra;1;2024-10-13 17:02:56;;3;Cancelado;Jeferson Klau;b4853fc1f03a3a4cec530a98a94d89ad
Quaerat reprehenderit totam ex nulla deserunt ducimus perspiciatis unde;Tarefa a Ser Feita;2;2024-06-29 15:35:06;;1;A Fazer;Pedro da Silva;f9a533f2c78e4a09f87c9e68e442d3fe
Comprar ipsa;Item de Compra;1;2023-12-08 22:01:21;;1;A Fazer;Pedro da Silva;f9a533f2c78e4a09f87c9e68e442d3fe
Comprar eius;Item de Compra;1;2024-11-09 16:40:18;2025-01-13 16:40:18;2;Concluído;Jeferson Klau;b4853fc1f03a3a4cec530a98a94d89ad
Quasi exercitationem odit maxime cum aut;Tarefa a Ser Feita;2;2024-12-23 18:23:12;;1;A Fazer;Jeferson Klau;b4853fc1f03a3a4cec530a98a94d89ad
Tenetur explicabo tempore;Tarefa a Ser Feita;2;2025-04-05 04:41:17;;1;A Fazer;Jeferson Klau;b4853fc1f03a3a4cec530a98a94d89ad
Vel aliquam;Tarefa a Ser Feita;2;2024-05-23 04:00:20;;1;A Fazer;Pedro da Silva;f9a533f2c78e4a09f87c9e68e442d3fe
Quasi;Tarefa a Ser Feita;2;2023-07-26 22:42:24;;1;A Fazer;Pedro da Silva;f9a533f2c78e4a09f87c9e68e442d3fe
Comprar est;Item de Compra;1;2023-06-27 11:50:57;2023-10-06 11:50:57;2;Concluído;Jeferson Klau;b4853fc1f03a3a4cec530a98a94d89ad
Comprar maiores;Item de Compra;1;2025-01-05 15:47:31;;1;A Fazer;Jeferson Klau;b4853fc1f03a3a4cec530a98a94d89ad
Comprar quidem;Item de Compra;1;2023-10-03 14:17:49;;3;Cancelado;Jeferson Klau;b4853fc1f03a3a4cec530a98a94d89ad
Ea vero blanditiis reprehenderit;Tarefa a Ser Feita;2;2023-12-08 13:03:30;;1;A Fazer;Jeferson Klau;b4853fc1f03a3a4cec530a98a94d89ad
Comprar voluptatem;Item de Compra;1;2025-02-24 04:39:49;;3;Cancelado;Jeferson Klau;b4853fc1f03a3a4cec530a98a94d89ad
Tempore optio;Tarefa a Ser Feita;2;2025-02-16 23:35:06;;1;A Fazer;Pedro da Silva;f9a533f2c78e4a09f87c9e68e442d3fe
Mollitia illo beatae nihil nihil mollitia maiores consectetur asperiores;Tarefa a Ser Feita;2;2025-04-15 10:42:55;;3;Cancelado;Jeferson Klau;b4853fc1f03a3a4cec530a98a94d89ad
Numquam pariatur expedita ab consequatur atque;Tarefa a Ser Feita;2;2023-08-18 22:36:34;;3;Cancelado;Pedro da Silva;f9a533f2c78e4a09f87c9e68e442d3fe
Numquam voluptatum voluptatibus incidunt facilis quos magnam;Tarefa a Ser Feita;2;2025-01-06 06:15:27;;1;A Fazer;Pedro da Silva;f9a533f2c78e4a09f87c9e68e442d3fe
Comprar ipsum;Item de Compra;1;2024-10-31 02:02:15;;1;A Fazer;Jeferson Klau;b4853fc1f03a3a4cec530a98a94d89ad
Recusandae ut;Tarefa a Ser Feita;2;2024-12-25 17:40:15;2025-06-02 21:09:40;2;Concluído;Pedro da Silva;f9a533f2c78e4a09f87c9e68e442d3fe
Comprar iusto;Item de Compra;1;2024-12-08 03:36:40;;1;A Fazer;Jeferson Klau;b4853fc1f03a3a4cec530a98a94d89ad
Recusandae perferendis atque;Tarefa a Ser Feita;2;2025-04-11 08:10:08;;3;Cancelado;Pedro da Silva;f9a533f2c78e4a09f87c9e68e442d3fe
Vel blanditiis officia;Tarefa a Ser Feita;2;2023-06-16 20:37:03;;3;Cancelado;Pedro da Silva;f9a533f2c78e4a09f87c9e68e442d3fe
Illo eum placeat placeat commodi laudantium et;Tarefa a Ser Feita;2;2024-01-27 08:21:31;;3;Cancelado;Pedro da Silva;f9a533f2c78e4a09f87c9e68e442d3fe
Voluptates accusantium eveniet in aperiam;Tarefa a Ser Feita;2;2023-06-10 16:27:07;;3;Cancelado;Pedro da Silva;f9a533f2c78e4a09f87c9e68e442d3fe
Comprar corrupti;Item de Compra;1;2024-10-13 11:35:49;;1;A Fazer;Jeferson Klau;b4853fc1f03a3a4cec530a98a94d89ad
Tempore ex dolores libero ducimus voluptatem beatae;Tarefa a Ser Feita;2;2024-01-25 22:17:53;2024-03-01 22:17:53;2;Concluído;Pedro da Silva;f9a533f2c78e4a09f87c9e68e442d3fe
Comprar odit;Item de Compra;1;2025-02-17 15:40:52;2025-06-02 21:24:40;2;Concluído;Jeferson Klau;b4853fc1f03a3a4cec530a98a94d89ad
Voluptatibus reiciendis sint aperiam deleniti ad labore;Tarefa a Ser Feita;2;2023-12-17 20:03:05;2024-02-28 20:03:05;2;Concluído;Pedro da Silva;f9a533f2c78e4a09f87c9e68e442d3fe
Comprar expedita;Item de Compra;1;2024-01-08 01:11:13;2024-01-26 01:11:13;2;Concluído;Jeferson Klau;b4853fc1f03a3a4cec530a98a94d89ad
Quasi consectetur aliquid sed;Tarefa a Ser Feita;2;2025-04-10 07:17:42;2025-06-02 21:16:40;2;Concluído;Pedro da Silva;f9a533f2c78e4a09f87c9e68e442d3fe
Comprar iusto;Item de Compra;1;2024-07-29 23:10:54;2024-12-08 23:10:54;2;Concluído;Jeferson Klau;b4853fc1f03a3a4cec530a98a94d89ad
Esse unde odit;Tarefa a Ser Feita;2;2023-12-30 11:15:30;;1;A Fazer;Pedro da Silva;f9a533f2c78e4a09f87c9e68e442d3fe
Comprar fugit;Item de Compra;1;2024-03-27 00:07:42;;3;Cancelado;Jeferson Klau;b4853fc1f03a3a4cec530a98a94d89ad
Comprar earum;Item de Compra;1;2023-07-10 10:24:43;;1;A Fazer;Pedro da Silva;f9a533f2c78e4a09f87c9e68e442d3fe
Comprar repellendus;Item de Compra;1;2024-07-27 23:57:00;;3;Cancelado;Jeferson Klau;b4853fc1f03a3a4cec530a98a94d89ad
Fuga sed a;Tarefa a Ser Feita;2;2023-12-30 12:03:46;;3;Cancelado;Pedro da Silva;f9a533f2c78e4a09f87c9e68e442d3fe
Omnis ratione dolorum;Tarefa a Ser Feita;2;2024-07-11 13:00:01;;1;A Fazer;Pedro da Silva;f9a533f2c78e4a09f87c9e68e442d3fe
Comprar odit;Item de Compra;1;2023-08-18 18:56:47;2023-12-13 18:56:47;2;Concluído;Jeferson Klau;b4853fc1f03a3a4cec530a98a94d89ad
Amet aliquid similique voluptatum maiores;Tarefa a Ser Feita;2;2024-05-18 11:16:56;2025-05-03 11:16:56;2;Concluído;Pedro da Silva;f9a533f2c78e4a09f87c9e68e442d3fe
Comprar quis;Item de Compra;1;2024-07-07 13:59:06;2025-04-05 13:59:06;2;Concluído;Jeferson Klau;b4853fc1f03a3a4cec530a98a94d89ad
Saepe minima odit blanditiis deleniti natus;Tarefa a Ser Feita;2;2025-01-08 21:56:47;;3;Cancelado;Jeferson Klau;b4853fc1f03a3a4cec530a98a94d89ad
Consequuntur minima tempora explicabo aperiam;Tarefa a Ser Feita;2;2025-01-01 06:05:12;2025-04-27 06:05:12;2;Concluído;Pedro da Silva;f9a533f2c78e4a09f87c9e68e442d3fe
Sit at;Tarefa a Ser Feita;2;2023-12-04 11:04:56;2024-06-14 11:04:56;2;Concluído;Pedro da Silva;f9a533f2c78e4a09f87c9e68e442d3fe
Comprar repellat;Item de Compra;1;2024-10-11 07:23:14;2024-11-01 07:23:14;2;Concluído;Jeferson Klau;b4853fc1f03a3a4cec530a98a94d89ad
Iusto aspernatur at impedit;Tarefa a Ser Feita;2;2023-07-24 17:09:55;;3;Cancelado;Pedro da Silva;f9a533f2c78e4a09f87c9e68e442d3fe
Quasi id quasi voluptas eaque necessitatibus iure quae at;Tarefa a Ser Feita;2;2024-03-17 23:04:16;2024-07-08 23:04:16;2;Concluído;Pedro da Silva;f9a533f2c78e4a09f87c9e68e442d3fe
Exercitationem amet assumenda;Tarefa a Ser Feita;2;2025-01-30 02:33:11;;3;Cancelado;Pedro da Silva;f9a533f2c78e4a09f87c9e68e442d3fe
Comprar animi;Item de Compra;1;2024-06-15 03:06:25;;1;A Fazer;Pedro da Silva;f9a533f2c78e4a09f87c9e68e442d3fe
Error dolorum et;Tarefa a Ser Feita;2;2023-08-28 21:34:34;;1;A Fazer;Jeferson Klau;b4853fc1f03a3a4cec530a98a94d89ad
Comprar quod;Item de Compra;1;2024-02-01 23:42:34;;1;A Fazer;Jeferson Klau;b4853fc1f03a3a4cec530a98a94d89ad
Comprar recusandae;Item de Compra;1;2024-03-07 14:31:08;;1;A Fazer;Pedro da Silva;f9a533f2c78e4a09f87c9e68e442d3fe
Odit accusamus quisquam enim earum fugiat cumque excepturi;Tarefa a Ser Feita;2;2024-10-01 09:17:08;;3;Cancelado;Pedro da Silva;f9a533f2c78e4a09f87c9e68e442d3fe
Voluptatem amet expedita dolore aperiam;Tarefa a Ser Feita;2;2023-11-29 03:13:04;;3;Cancelado;Jeferson Klau;b4853fc1f03a3a4cec530a98a94d89ad
Impedit ipsum assumenda;Tarefa a Ser Feita;2;2024-09-22 05:47:10;;1;A Fazer;Pedro da Silva;f9a533f2c78e4a09f87c9e68e442d3fe
Neque soluta numquam animi ea;Tarefa a Ser Feita;2;2025-01-25 11:49:10;;3;Cancelado;Jeferson Klau;b4853fc1f03a3a4cec530a98a94d89ad
Fuga quam voluptas tenetur earum sequi;Tarefa a Ser Feita;2;2024-01-07 03:59:54;2024-09-26 03:59:54;2;Concluído;Pedro da Silva;f9a533f2c78e4a09f87c9e68e442d3fe
Aspernatur tempore enim laborum;Tarefa a Ser Feita;2;2023-07-26 12:40:03;;3;Cancelado;Pedro da Silva;f9a533f2c78e4a09f87c9e68e442d3fe
Consectetur ipsam quod;Tarefa a Ser Feita;2;2024-05-24 22:34:22;;1;A Fazer;Jeferson Klau;b4853fc1f03a3a4cec530a98a94d89ad
Ratione adipisci aspernatur eius enim inventore hic;Tarefa a Ser Feita;2;2023-12-25 08:21:11;;1;A Fazer;Pedro da Silva;f9a533f2c78e4a09f87c9e68e442d3fe
Comprar possimus;Item de Compra;1;2024-01-21 13:44:55;;3;Cancelado;Pedro da Silva;f9a533f2c78e4a09f87c9e68e442d3fe
Vero minima maiores tempora ratione;Tarefa a Ser Feita;2;2025-01-28 13:15:52;;3;Cancelado;Pedro da Silva;f9a533f2c78e4a09f87c9e68e442d3fe
Rerum;Tarefa a Ser Feita;2;2023-06-19 17:12:31;;1;A Fazer;Pedro da Silva;f9a533f2c78e4a09f87c9e68e442d3fe
Quisquam alias quae facere ea ipsa voluptates alias necessitatibus;Tarefa a Ser Feita;2;2023-10-12 13:31:34;;3;Cancelado;Pedro da Silva;f9a533f2c78e4a09f87c9e68e442d3fe
Comprar impedit;Item de Compra;1;2024-05-03 10:26:57;2024-12-19 10:26:57;2;Concluído;Pedro da Silva;f9a533f2c78e4a09f87c9e68e442d3fe
Quia amet exercitationem voluptatum recusandae;Tarefa a Ser Feita;2;2023-10-13 08:15:50;;1;A Fazer;Pedro da Silva;f9a533f2c78e4a09f87c9e68e442d3fe
Comprar perspiciatis;Item de Compra;1;2024-04-03 18:54:19;;1;A Fazer;Pedro da Silva;f9a533f2c78e4a09f87c9e68e442d3fe
Comprar tempore;Item de Compra;1;2025-01-16 09:04:38;;1;A Fazer;Jeferson Klau;b4853fc1f03a3a4cec530a98a94d89ad
Ratione quod ratione;Tarefa a Ser Feita;2;2025-05-22 15:08:59;2025-06-02 21:37:40;2;Concluído;Pedro da Silva;f9a533f2c78e4a09f87c9e68e442d3fe
Nemo dolorum rem officiis;Tarefa a Ser Feita;2;2024-09-04 16:43:40;2025-06-02 21:44:40;2;Concluído;Jeferson Klau;b4853fc1f03a3a4cec530a98a94d89ad
Comprar ducimus;Item de Compra;1;2024-09-27 23:14:52;;3;Cancelado;Jeferson Klau;b4853fc1f03a3a4cec530a98a94d89ad
Sapiente a eaque illo dignissimos;Tarefa a Ser Feita;2;2023-12-12 05:03:02;;3;Cancelado;Jeferson Klau;b4853fc1f03a3a4cec530a98a94d89ad
Quisquam laboriosam iure ad quo;Tarefa a Ser Feita;2;2024-10-12 16:06:21;;1;A Fazer;Jeferson Klau;b4853fc1f03a3a4cec530a98a94d89ad
Ipsum perspiciatis quo inventore error neque consectetur deleniti debitis;Tarefa a Ser Feita;2;2024-04-17 10:10:44;;1;A Fazer;Pedro da Silva;f9a533f2c78e4a09f87c9e68e442d3fe
Ipsam dicta ut mollitia;Tarefa a Ser Feita;2;2024-01-02 20:59:15;2024-07-05 20:59:15;2;Concluído;Jeferson Klau;b4853fc1f03a3a4cec530a98a94d89ad
Comprar recusandae;Item de Compra;1;2024-11-24 05:23:50;;1;A Fazer;Jeferson Klau;b4853fc1f03a3a4cec530a98a94d89ad
Officiis dolores beatae;Tarefa a Ser Feita;2;2025-02-02 19:54:09;2025-06-02 20:59:40;2;Concluído;Jeferson Klau;b4853fc1f03a3a4cec530a98a94d89ad
Comprar dicta;Item de Compra;1;2024-09-18 21:57:23;;3;Cancelado;Pedro da Silva;f9a533f2c78e4a09f87c9e68e442d3fe
Maxime tempora vitae;Tarefa a Ser Feita;2;2024-04-24 19:12:22;;1;A Fazer;Jeferson Klau;b4853fc1f03a3a4cec530a98a94d89ad
Commodi eos ab vitae;Tarefa a Ser Feita;2;2023-11-30 00:48:03;2024-02-13 00:48:03;2;Concluído;Jeferson Klau;b4853fc1f03a3a4cec530a98a94d89ad
Dignissimos explicabo quis repudiandae;Tarefa a Ser Feita;2;2024-12-03 15:10:28;2025-06-02 21:07:40;2;Concluído;Pedro da Silva;f9a533f2c78e4a09f87c9e68e442d3fe
Ad reprehenderit voluptatem;Tarefa a Ser Feita;2;2023-11-06 11:04:06;2024-04-19 11:04:06;2;Concluído;Jeferson Klau;b4853fc1f03a3a4cec530a98a94d89ad
Voluptate natus laudantium quo blanditiis voluptate ipsam;Tarefa a Ser Feita;2;2023-06-28 13:47:30;2023-09-11 13:47:30;2;Concluído;Jeferson Klau;b4853fc1f03a3a4cec530a98a94d89ad
Voluptatibus fugit corrupti unde blanditiis;Tarefa a Ser Feita;2;2023-11-03 02:59:23;;3;Cancelado;Jeferson Klau;b4853fc1f03a3a4cec530a98a94d89ad
Maxime eius deleniti dolorem;Tarefa a Ser Feita;2;2025-03-27 20:17:19;;3;Cancelado;Jeferson Klau;b4853fc1f03a3a4cec530a98a94d89ad
Exercitationem ex quod;Tarefa a Ser Feita;2;2023-11-26 09:08:35;;1;A Fazer;Pedro da Silva;f9a533f2c78e4a09f87c9e68e442d3fe
Et voluptatem veritatis;Tarefa a Ser Feita;2;2023-12-06 18:42:45;;1;A Fazer;Jeferson Klau;b4853fc1f03a3a4cec530a98a94d89ad
Voluptates repellat omnis ab ab sit totam;Tarefa a Ser Feita;2;2024-09-03 16:38:07;;3;Cancelado;Pedro da Silva;f9a533f2c78e4a09f87c9e68e442d3fe
Comprar exercitationem;Item de Compra;1;2025-01-15 17:29:15;;3;Cancelado;Pedro da Silva;f9a533f2c78e4a09f87c9e68e442d3fe
Comprar nihil;Item de Compra;1;2025-05-14 05:57:30;;1;A Fazer;Jeferson Klau;b4853fc1f03a3a4cec530a98a94d89ad
Error repudiandae sapiente neque occaecati recusandae soluta omnis;Tarefa a Ser Feita;2;2025-01-20 08:18:13;2025-06-02 21:37:40;2;Concluído;Pedro da Silva;f9a533f2c78e4a09f87c9e68e442d3fe
Comprar quasi;Item de Compra;1;2025-05-20 07:27:41;;3;Cancelado;Jeferson Klau;b4853fc1f03a3a4cec530a98a94d89ad
Quis hic voluptate assumenda eius explicabo dolorem magni ad;Tarefa a Ser Feita;2;2024-09-16 14:05:46;;1;A Fazer;Jeferson Klau;b4853fc1f03a3a4cec530a98a94d89ad
Alias commodi ipsam totam commodi aspernatur est quasi;Tarefa a Ser Feita;2;2024-11-30 12:07:17;2025-03-18 12:07:17;2;Concluído;Pedro da Silva;f9a533f2c78e4a09f87c9e68e442d3fe
Comprar similique;Item de Compra;1;2024-04-25 07:27:39;;1;A Fazer;Jeferson Klau;b4853fc1f03a3a4cec530a98a94d89ad
Comprar atque;Item de Compra;1;2024-07-05 08:25:28;;3;Cancelado;Jeferson Klau;b4853fc1f03a3a4cec530a98a94d89ad
Incidunt maxime sint itaque;Tarefa a Ser Feita;2;2025-02-16 11:06:33;2025-06-02 21:21:40;2;Concluído;Jeferson Klau;b4853fc1f03a3a4cec530a98a94d89ad
Eius fugit atque fugiat voluptatem iure;Tarefa a Ser Feita;2;2024-03-13 22:28:46;2024-07-20 22:28:46;2;Concluído;Jeferson Klau;b4853fc1f03a3a4cec530a98a94d89ad
Molestias ut iusto vitae nam;Tarefa a Ser Feita;2;2024-12-05 02:52:05;;3;Cancelado;Pedro da Silva;f9a533f2c78e4a09f87c9e68e442d3fe
Rerum veritatis ipsum;Tarefa a Ser Feita;2;2023-11-21 12:37:12;;1;A Fazer;Jeferson Klau;b4853fc1f03a3a4cec530a98a94d89ad
Asperiores dicta;Tarefa a Ser Feita;2;2023-06-30 06:57:34;;3;Cancelado;Jeferson Klau;b4853fc1f03a3a4cec530a98a94d89ad
Animi ea aperiam ipsum;Tarefa a Ser Feita;2;2023-06-11 23:22:43;;3;Cancelado;Pedro da Silva;f9a533f2c78e4a09f87c9e68e442d3fe
Iste iusto velit praesentium excepturi et;Tarefa a Ser Feita;2;2024-08-21 14:29:53;2025-01-28 14:29:53;2;Concluído;Pedro da Silva;f9a533f2c78e4a09f87c9e68e442d3fe
Nemo repellat quae voluptatem magni laudantium sed eveniet;Tarefa a Ser Feita;2;2024-02-06 03:31:33;;3;Cancelado;Pedro da Silva;f9a533f2c78e4a09f87c9e68e442d3fe
Magni quod;Tarefa a Ser Feita;2;2024-12-31 00:35:36;2025-06-02 21:41:40;2;Concluído;Pedro da Silva;f9a533f2c78e4a09f87c9e68e442d3fe
Comprar laboriosam;Item de Compra;1;2024-07-19 10:22:42;;3;Cancelado;Jeferson Klau;b4853fc1f03a3a4cec530a98a94d89ad
Placeat quasi non provident unde magni animi totam;Tarefa a Ser Feita;2;2025-04-27 03:19:49;2025-06-02 21:19:40;2;Concluído;Jeferson Klau;b4853fc1f03a3a4cec530a98a94d89ad
