Ab in vitae;Tarefa a Ser Feita;2;2024-04-25 20:09:11;2024-12-19 20:09:11;2;Concluído;Pedro da Silva;f9a533f2c78e4a09f87c9e68e442d3fe
Ipsam at;Tarefa a Ser Feita;2;2024-07-02 22:12:05;2024-07-26 22:12:05;2;Concluído;Pedro da Silva;f9a533f2c78e4a09f87c9e68e442d3fe
Architecto sequi quo et quo aliquam doloribus;Tarefa a Ser Feita;2;2023-06-16 23:32:02;;3;Cancelado;Jeferson Klau;b4853fc1f03a3a4cec530a98a94d89ad
Comprar debitis;Item de Compra;1;2024-04-22 03:07:27;;1;A Fazer;Jeferson Klau;b4853fc1f03a3a4cec530a98a94d89ad
Comprar exercitationem;Item de Compra;1;2024-05-27 03:28:31;;1;A Fazer;Jeferson Klau;b4853fc1f03a3a4cec530a98a94d89ad
Comprar tenetur;Item de Compra;1;2024-05-18 18:08:20;2024-12-17 18:08:20;2;Concluído;Jeferson Klau;b4853fc1f03a3a4cec530a98a94d89ad
Odit recusandae qui;Tarefa a Ser Feita;2;2024-06-12 03:11:22;;3;Cancelado;Jeferson Klau;b4853fc1f03a3a4cec530a98a94d89ad
Comprar explicabo;Item de Compra;1;2024-04-10 08:22:55;2024-10-24 08:22:55;2;Concluído;Pedro da Silva;f9a533f2c78e4a09f87c9e68e442d3fe
Sed quod tempora;Tarefa a Ser Feita;2;2025-03-11 21:13:28;;1;A Fazer;Jeferson Klau;b4853fc1f03a3a4cec530a98a94d89ad
Assumenda blanditiis dolorem;Tarefa a Ser Feita;2;2024-03-23 20:44:14;;1;A Fazer;Jeferson Klau;b4853fc1f03a3a4cec530a98a94d89ad
Comprar natus;Item de Compra;1;2024-07-22 22:37:53;;1;A Fazer;Pedro da Silva;f9a533f2c78e4a09f87c9e68e442d3fe
Esse nemo autem accusantium;Tarefa a Ser Feita;2;2025-04-02 06:59:24;2025-06-02 21:46:40;2;Concluído;Pedro da Silva;f9a533f2c78e4a09f87c9e68e442d3fe
Comprar quia;Item de Compra;1;2024-08-23 10:18:29;;3;Cancelado;Pedro da Silva;f9a533f2c78e4a09f87c9e68e442d3fe
Veniam sequi odio nisi;Tarefa a Ser Feita;2;2024-03-01 09:10:00;;1;A Fazer;Jeferson Klau;b4853fc1f03a3a4cec530a98a94d89ad
Comprar voluptatum;Item de Compra;1;2024-11-05 15:46:47;2024-11-15 15:46:47;2;Concluído;Jeferson Klau;b4853fc1f03a3a4cec530a98a94d89ad
Sequi dolorem;Tarefa a Ser Feita;2;2025-01-23 22:11:17;2025-06-02 21:31:40;2;Concluído;Pedro da Silva;f9a533f2c78e4a09f87c9e68e442d3fe
Rerum voluptatem iste;Tarefa a Ser Feita;2;2023-11-29 14:48:47;;1;A Fazer;Pedro da Silva;f9a533f2c78e4a09f87c9e68e442d3fe
Comprar quasi;Item de Compra;1;2024-01-18 22:38:41;2024-09-11 22:38:41;2;Concluído;Pedro da Silva;f9a533f2c78e4a09f87c9e68e442d3fe
Comprar veniam;Item de Compra;1;2023-12-25 19:33:49;;1;A Fazer;Pedro da Silva;f9a533f2c78e4a09f87c9e68e442d3fe
Laudantium maiores;Tarefa a Ser Feita;2;2024-02-06 00:14:03;;3;Cancelado;Jeferson Klau;b4853fc1f03a3a4cec530a98a94d89ad
Comprar adipisci;Item de Compra;1;2024-08-27 09:59:47;2024-11-01 09:59:47;2;Concluído;Pedro da Silva;f9a533f2c78e4a09f87c9e68e442d3fe
Comprar dolores;Item de Compra;1;2023-12-15 17:51:08;2024-08-02 17:51:08;2;Concluído;Jeferson Klau;b4853fc1f03a3a4cec530a98a94d89ad
Voluptate possimus autem animi;Tarefa a Ser Feita;2;2024-11-08 05:12:03;;3;Cancelado;Pedro da Silva;f9a533f2c78e4a09f87c9e68e442d3fe
Exercitationem placeat corporis saepe;Tarefa a Ser Feita;2;2023-10-11 10:11:09;;1;A Fazer;Jeferson Klau;b4853fc1f03a3a4cec530a98a94d89ad
Quae natus ipsum minus quod dolorem ex magni;Tarefa a Ser Feita;2;2024-06-03 14:42:08;2025-04-10 14:42:08;2;Concluído;Pedro da Silva;f9a533f2c78e4a09f87c9e68e442d3fe
Accusamus quaerat provident similique vel veritatis voluptatum asperiores;Tarefa a Ser Feita;2;2024-02-18 08:10:55;;3;Cancelado;Jeferson Klau;b4853fc1f03a3a4cec530a98a94d89ad
Comprar nulla;Item de Compra;1;2024-06-17 20:33:32;;3;Cancelado;Jeferson Klau;b4853fc1f03a3a4cec530a98a94d89ad
Enim consequuntur eius adipisci delectus;Tarefa a Ser Feita;2;2024-05-10 21:20:48;;1;A Fazer;Pedro da Silva;f9a533f2c78e4a09f87c9e68e442d3fe
Soluta ipsum unde cupiditate ad dolore maiores quisquam harum;Tarefa a Ser Feita;2;2025-02-18 01:03:39;2025-04-16 01:03:39;2;Concluído;Jeferson Klau;b4853fc1f03a3a4cec530a98a94d89ad
Quam doloremque tenetur eius reiciendis molestiae unde;Tarefa a Ser Feita;2;2023-06-05 04:22:07;;3;Cancelado;Jeferson Klau;b4853fc1f03a3a4cec530a98a94d89ad
Comprar laboriosam;Item de Compra;1;2024-09-03 14:13:18;2024-11-24 14:13:18;2;Concluído;Jeferson Klau;b4853fc1f03a3a4cec530a98a94d89ad
Comprar veritatis;Item de Compra;1;2023-10-03 00:47:14;;1;A Fazer;Jeferson Klau;b4853fc1f03a3a4cec530a98a94d89ad
Comprar a;Item de Compra;1;2025-04-15 22:48:32;;1;A Fazer;Jeferson Klau;b4853fc1f03a3a4cec530a98a94d89ad
Cupiditate harum dignissimos;Tarefa a Ser Feita;2;2024-09-19 06:41:34;2025-05-26 06:41:34;2;Concluído;Pedro da Silva;f9a533f2c78e4a09f87c9e68e442d3fe
Perferendis sed est fugiat minus;Tarefa a Ser Feita;2;2024-12-18 09:17:30;;3;Cancelado;Pedro da Silva;f9a533f2c78e4a09f87c9e68e442d3fe
Modi enim rem fugit praesentium;Tarefa a Ser Feita;2;2025-05-22 20:41:52;;3;Cancelado;Jeferson Klau;b4853fc1f03a3a4cec530a98a94d89ad
Comprar ipsa;Item de Compra;1;2023-08-08 09:05:38;2024-05-18 09:05:38;2;Concluído;Jeferson Klau;b4853fc1f03a3a4cec530a98a94d89ad
Comprar ipsam;Item de Compra;1;2023-07-10 06:43:36;;1;A Fazer;Jeferson Klau;b4853fc1f03a3a4cec530a98a94d89ad
Comprar sapiente;Item de Compra;1;2024-12-27 16:15:01;2024-12-30 16:15:01;2;Concluído;Jeferson Klau;b4853fc1f03a3a4cec530a98a94d89ad
Vel eveniet tempore;Tarefa a Ser Feita;2;2024-07-06 03:49:40;;1;A Fazer;Pedro da Silva;f9a533f2c78e4a09f87c9e68e442d3fe
Minus dolor dignissimos molestiae;Tarefa a Ser Feita;2;2025-01-15 13:13:03;2025-06-02 21:25:40;2;Concluído;Pedro da Silva;f9a533f2c78e4a09f87c9e68e442d3fe
Quod vitae reprehenderit aliquam labore laudantium dolorem commodi deleniti;Tarefa a Ser Feita;2;2024-05-30 08:06:11;;3;Cancelado;Pedro da Silva;f9a533f2c78e4a09f87c9e68e442d3fe
Fugit nostrum nostrum;Tarefa a Ser Feita;2;2023-08-18 03:36:25;;3;Cancelado;Pedro da Silva;f9a533f2c78e4a09f87c9e68e442d3fe
Necessitatibus voluptates eaque;Tarefa a Ser Feita;2;2024-06-05 20:00:07;2025-03-18 20:00:07;2;Concluído;Pedro da Silva;f9a533f2c78e4a09f87c9e68e442d3fe
Hic dicta sequi ut;Tarefa a Ser Feita;2;2024-08-19 20:42:21;;3;Cancelado;Pedro da Silva;f9a533f2c78e4a09f87c9e68e442d3fe
Hic repellat nobis nostrum;Tarefa a Ser Feita;2;2024-10-16 04:38:08;;3;Cancelado;Pedro da Silva;f9a533f2c78e4a09f87c9e68e442d3fe
Comprar temporibus;Item de Compra;1;2025-03-13 23:52:24;;3;Cancelado;Jeferson Klau;b4853fc1f03a3a4cec530a98a94d89ad
Eveniet;Tarefa a Ser Feita;2;2024-09-02 14:17:31;;3;Cancelado;Pedro da Silva;f9a533f2c78e4a09f87c9e68e442d3fe
Sint dolorum minima quasi sequi;Tarefa a Ser Feita;2;2024-05-03 02:03:12;;3;Cancelado;Jeferson Klau;b4853fc1f03a3a4cec530a98a94d89ad
Comprar quia;Item de Compra;1;2025-02-15 09:20:15;;3;Cancelado;Pedro da Silva;f9a533f2c78e4a09f87c9e68e442d3fe
Ea cumque minima;Tarefa a Ser Feita;2;2023-10-08 10:23:59;;1;A Fazer;Pedro da Silva;f9a533f2c78e4a09f87c9e68e442d3fe
Aut quo officiis soluta error tempore;Tarefa a Ser Feita;2;2025-03-23 10:55:47;;3;Cancelado;Jeferson Klau;b4853fc1f03a3a4cec530a98a94d89ad
Iure eius;Tarefa a Ser Feita;2;2024-10-10 18:34:19;2024-11-29 18:34:19;2;Concluído;Pedro da Silva;f9a533f2c78e4a09f87c9e68e442d3fe
Eligendi at error porro;Tarefa a Ser Feita;2;2025-05-31 10:19:13;2025-06-02 21:46:40;2;Concluído;Jeferson Klau;b4853fc1f03a3a4cec530a98a94d89ad
Comprar veritatis;Item de Compra;1;2025-01-03 11:29:05;;3;Cancelado;Jeferson Klau;b4853fc1f03a3a4cec530a98a94d89ad
Dolorum quam excepturi;Tarefa a Ser Feita;2;2024-12-28 03:42:46;;3;Cancelado;Pedro da Silva;f9a533f2c78e4a09f87c9e68e442d3fe
Comprar adipisci;Item de Compra;1;2023-09-07 13:07:12;;3;Cancelado;Pedro da Silva;f9a533f2c78e4a09f87c9e68e442d3fe
Ipsam aperiam ipsam labore nisi autem;Tarefa a Ser Feita;2;2024-09-08 19:58:54;2024-11-14 19:58:54;2;Concluído;Pedro da Silva;f9a533f2c78e4a09f87c9e68e442d3fe
Sapiente repellat inventore;Tarefa a Ser Feita;2;2024-09-01 18:06:48;2025-06-02 21:31:40;2;Concluído;Pedro da Silva;f9a533f2c78e4a09f87c9e68e442d3fe
Comprar ex;Item de Compra;1;2023-06-19 00:52:26;;3;Cancelado;Pedro da Silva;f9a533f2c78e4a09f87c9e68e442d3fe
Comprar asperiores;Item de Compra;1;2024-03-28 15:11:34;2025-02-28 15:11:34;2;Concluído;Pedro da Silva;f9a533f2c78e4a09f87c9e68e442d3fe
Libero nihil provident;Tarefa a Ser Feita;2;2023-10-03 14:47:26;;1;A Fazer;Pedro da Silva;f9a533f2c78e4a09f87c9e68e442d3fe
Comprar consectetur;Item de Compra;1;2025-05-31 07:00:29;;3;Cancelado;Pedro da Silva;f9a533f2c78e4a09f87c9e68e442d3fe
Quaerat neque incidunt doloribus id dolorum;Tarefa a Ser Feita;2;2023-08-20 05:59:26;;1;A Fazer;Jeferson Klau;b4853fc1f03a3a4cec530a98a94d89ad
Impedit itaque dolor officia quasi delectus quia;Tarefa a Ser Feita;2;2024-08-08 15:09:36;2025-01-25 15:09:36;2;Concluído;Pedro da Silva;f9a533f2c78e4a09f87c9e68e442d3fe
Eaque laborum doloremque dolore quisquam aspernatur laborum iusto;Tarefa a Ser Feita;2;2023-12-19 16:17:22;;3;Cancelado;Jeferson Klau;b4853fc1f03a3a4cec530a98a94d89ad
Ea id ea quidem suscipit beatae nihil deserunt expedita;Tarefa a Ser Feita;2;2025-05-04 17:41:55;2025-06-02 21:44:40;2;Concluído;Pedro da Silva;f9a533f2c78e4a09f87c9e68e442d3fe
Comprar quia;Item de Compra;1;2024-01-27 08:44:55;;1;A Fazer;Pedro da Silva;f9a533f2c78e4a09f87c9e68e442d3fe
Comprar delectus;Item de Compra;1;2024-02-17 14:54:12;;3;Cancelado;Pedro da Silva;f9a533f2c78e4a09f87c9e68e442d3fe
Comprar tempore;Item de Compra;1;2025-02-27 13:19:37;;1;A Fazer;Pedro da Silva;f9a533f2c78e4a09f87c9e68e442d3fe
Consequatur maiores enim temporibus;Tarefa a Ser Feita;2;2025-04-15 11:39:46;;3;Cancelado;Pedro da Silva;f9a533f2c78e4a09f87c9e68e442d3fe
Comprar hic;Item de Compra;1;2024-12-19 23:39:08;;1;A Fazer;Jeferson Klau;b4853fc1f03a3a4cec530a98a94d89ad
Delectus necessitatibus ex commodi commodi;Tarefa a Ser Feita;2;2024-06-22 17:11:25;;3;Cancelado;Pedro da Silva;f9a533f2c78e4a09f87c9e68e442d3fe
Comprar molestias;Item de Compra;1;2024-09-29 03:18:41;;3;Cancelado;Jeferson Klau;b4853fc1f03a3a4cec530a98a94d89ad
Comprar enim;Item de Compra;1;2024-01-26 06:37:50;2024-10-29 06:37:50;2;Concluído;Jeferson Klau;b4853fc1f03a3a4cec530a98a94d89ad
Comprar odit;Item de Compra;1;2024-11-20 09:40:57;;1;A Fazer;Jeferson Klau;b4853fc1f03a3a4cec530a98a94d89ad
Reprehenderit sit eaque natus quod;Tarefa a Ser Feita;2;2024-02-02 01:42:04;;3;Cancelado;Pedro da Silva;f9a533f2c78e4a09f87c9e68e442d3fe
Minus iure;Tarefa a Ser Feita;2;2024-01-14 10:58:55;;1;A Fazer;Jeferson Klau;b4853fc1f03a3a4cec530a98a94d89ad
Voluptatibus inventore inventore quas voluptatem non similique;Tarefa a Ser Feita;2;2023-10-13 17:42:11;2024-02-19 17:42:11;2;Concluído;Jeferson Klau;b4853fc1f03a3a4cec530a98a94d89ad
Eum reiciendis voluptates dignissimos iste voluptatum ex minima;Tarefa a Ser Feita;2;2025-02-20 15:24:35;;1;A Fazer;Jeferson Klau;b4853fc1f03a3a4cec530a98a94d89ad
Praesentium voluptas minus ipsam asperiores;Tarefa a Ser Feita;2;2024-01-12 04:39:02;2024-12-21 04:39:02;2;Concluído;Pedro da Silva;f9a533f2c78e4a09f87c9e68e442d3fe
Eaque suscipit totam esse quisquam;Tarefa a Ser Feita;2;2024-08-08 02:59:13;2024-09-01 02:59:13;2;Concluído;Jeferson Klau;b4853fc1f03a3a4cec530a98a94d89ad
Accusamus quaerat quaerat repellendus aspernatur;Tarefa a Ser Feita;2;2025-05-29 18:13:37;;3;Cancelado;Pedro da Silva;f9a533f2c78e4a09f87c9e68e442d3fe
Facilis exercitationem a;Tarefa a Ser Feita;2;2023-08-25 17:06:42;2024-05-15 17:06:42;2;Concluído;Jeferson Klau;b4853fc1f03a3a4cec530a98a94d89ad
Reprehenderit sed officia ipsum;Tarefa a Ser Feita;2;2024-12-09 01:37:02;;3;Cancelado;Jeferson Klau;b4853fc1f03a3a4cec530a98a94d89ad
Perspiciatis eos deserunt ratione aperiam asperiores;Tarefa a Ser Feita;2;2024-11-22 14:42:09;2025-02-24 14:42:09;2;Concluído;Jeferson Klau;b4853fc1f03a3a4cec530a98a94d89ad
Fuga nesciunt possimus asperiores aliquam eos;Tarefa a Ser Feita;2;2024-07-05 17:39:23;;3;Cancelado;Pedro da Silva;f9a533f2c78e4a09f87c9e68e442d3fe
Inventore natus consequuntur consequatur assumenda deleniti minima nesciunt in;Tarefa a Ser Feita;2;2023-12-18 23:59:06;2024-08-15 23:59:06;2;Concluído;Pedro da Silva;f9a533f2c78e4a09f87c9e68e442d3fe
Quasi iusto odio praesentium voluptatibus;Tarefa a Ser Feita;2;2025-04-27 01:50:24;;1;A Fazer;Pedro da Silva;f9a533f2c78e4a09f87c9e68e442d3fe
Eligendi sint quibusdam sint;Tarefa a Ser Feita;2;2024-03-30 00:02:59;2024-11-24 00:02:59;2;Concluído;Jeferson Klau;b4853fc1f03a3a4cec530a98a94d89ad
Error quas;Tarefa a Ser Feita;2;2023-07-11 06:28:22;;1;A Fazer;Pedro da Silva;f9a533f2c78e4a09f87c9e68e442d3fe
Autem accusantium asperiores cum iusto;Tarefa a Ser Feita;2;2025-02-07 16:05:50;;1;A Fazer;Jeferson Klau;b4853fc1f03a3a4cec530a98a94d89ad
Soluta nobis officia aperiam esse quidem;Tarefa a Ser Feita;2;2024-08-18 20:31:41;;1;A Fazer;Jeferson Klau;b4853fc1f03a3a4cec530a98a94d89ad
Eligendi expedita doloremque provident nulla beatae;Tarefa a Ser Feita;2;2025-03-07 15:58:57;;3;Cancelado;Pedro da Silva;f9a533f2c78e4a09f87c9e68e442d3fe
Expedita porro in dignissimos;Tarefa a Ser Feita;2;2025-03-09 02:11:27;;1;A Fazer;Pedro da Silva;f9a533f2c78e4a09f87c9e68e442d3fe
Comprar facere;Item de Compra;1;2024-08-24 18:38:28;2024-08-25 18:38:28;2;Concluído;Pedro da Silva;f9a533f2c78e4a09f87c9e68e442d3fe
Nesciunt magni quaerat;Tarefa a Ser Feita;2;2024-03-16 23:20:05;;3;Cancelado;Pedro da Silva;f9a533f2c78e4a09f87c9e68e442d3fe
Comprar consectetur;Item de Compra;1;2024-07-21 10:44:44;;1;A Fazer;Jeferson Klau;b4853fc1f03a3a4cec530a98a94d89ad
Deleniti eius libero nobis sequi ducimus;Tarefa a Ser Feita;2;2024-08-23 18:54:10;;3;Cancelado;Jeferson Klau;b4853fc1f03a3a4cec530a98a94d89ad
Quos molestias corporis a autem officiis eligendi recusandae quos;Tarefa a Ser Feita;2;2024-05-17 11:46:17;2024-07-07 11:46:17;2;Concluído;Jeferson Klau;b4853fc1f03a3a4cec530a98a94d89ad
Expedita numquam dicta repellendus facere laboriosam;Tarefa a Ser Feita;2;2025-02-12 00:46:51;;1;A Fazer;Jeferson Klau;b4853fc1f03a3a4cec530a98a94d89ad
Comprar veniam;Item de Compra;1;2025-02-20 17:12:24;2025-02-21 17:12:24;2;Concluído;Pedro da Silva;f9a533f2c78e4a09f87c9e68e442d3fe
Occaecati odio facilis;Tarefa a Ser Feita;2;2025-03-15 22:25:01;;3;Cancelado;Pedro da Silva;f9a533f2c78e4a09f87c9e68e442d3fe
Possimus sint mollitia;Tarefa a Ser Feita;2;2025-02-06 19:52:49;;3;Cancelado;Jeferson Klau;b4853fc1f03a3a4cec530a98a94d89ad
Quis minima reprehenderit repellat eveniet rem;Tarefa a Ser Feita;2;2023-11-30 23:49:55;;1;A Fazer;Jeferson Klau;b4853fc1f03a3a4cec530a98a94d89ad
Comprar corporis;Item de Compra;1;2023-10-26 09:20:32;;1;A Fazer;Pedro da Silva;f9a533f2c78e4a09f87c9e68e442d3fe
Ipsam deleniti voluptas;Tarefa a Ser Feita;2;2024-08-27 08:49:27;;1;A Fazer;Pedro da Silva;f9a533f2c78e4a09f87c9e68e442d3fe
Rerum vero reprehenderit ad;Tarefa a Ser Feita;2;2024-12-09 01:42:33;2025-06-02 21:27:40;2;Concluído;Pedro da Silva;f9a533f2c78e4a09f87c9e68e442d3fe
Ut error iste;Tarefa a Ser Feita;2;2023-08-25 11:06:58;;3;Cancelado;Jeferson Klau;b4853fc1f03a3a4cec530a98a94d89ad
Ratione voluptates exercitationem officia blanditiis;Tarefa a Ser Feita;2;2024-07-01 20:24:17;;3;Cancelado;Jeferson Klau;b4853fc1f03a3a4cec530a98a94d89ad
Comprar ratione;Item de Compra;1;2024-07-08 08:24:09;2025-04-15 08:24:09;2;Concluído;Jeferson Klau;b4853fc1f03a3a4cec530a98a94d89ad
Comprar delectus;Item de Compra;1;2025-04-17 11:45:28;;3;Cancelado;Pedro da Silva;f9a533f2c78e4a09f87c9e68e442d3fe
A itaque ex;Tarefa a Ser Feita;2;2023-12-08 23:31:42;;1;A Fazer;Pedro da Silva;f9a533f2c78e4a09f87c9e68e442d3fe
Comprar modi;Item de Compra;1;2025-05-09 21:50:02;;1;A Fazer;Pedro da Silva;f9a533f2c78e4a09f87c9e68e442d3fe
Quisquam nemo deleniti qui iure;Tarefa a Ser Feita;2;2025-01-17 16:06:39;;1;A Fazer;Pedro da Silva;f9a533f2c78e4a09f87c9e68e442d3fe
Voluptatem reprehenderit natus;Tarefa a Ser Feita;2;2025-04-06 20:17:23;;3;Cancelado;Pedro da Silva;f9a533f2c78e4a09f87c9e68e442d3fe
Autem quaerat voluptate;Tarefa a Ser Feita;2;2023-12-12 21:45:47;;1;A Fazer;Jeferson Klau;b4853fc1f03a3a4cec530a98a94d89ad
Comprar praesentium;Item de Compra;1;2024-01-16 09:58:29;2024-12-17 09:58:29;2;Concluído;Pedro da Silva;f9a533f2c78e4a09f87c9e68e442d3fe
Comprar hic;Item de Compra;1;2025-02-11 03:01:38;2025-06-02 21:21:40;2;Concluído;Jeferson Klau;b4853fc1f03a3a4cec530a98a94d89ad
Dolor;Tarefa a Ser Feita;2;2024-07-23 04:58:37;;1;A Fazer;Pedro da Silva;f9a533f2c78e4a09f87c9e68e442d3fe
Laudantium nulla;Tarefa a Ser Feita;2;2024-07-28 00:33:16;;1;A Fazer;Jeferson Klau;b4853fc1f03a3a4cec530a98a94d89ad
Comprar aspernatur;Item de Compra;1;2024-12-05 04:14:03;2025-06-02 21:20:40;2;Concluído;Jeferson Klau;b4853fc1f03a3a4cec530a98a94d89ad
Molestiae quidem dignissimos blanditiis;Tarefa a Ser Feita;2;2023-11-12 13:23:34;2024-05-05 13:23:34;2;Concluído;Pedro da Silva;f9a533f2c78e4a09f87c9e68e442d3fe
Veniam harum ipsum illum quae expedita;Tarefa a Ser Feita;2;2023-09-23 04:24:12;2024-09-13 04:24:12;2;Concluído;Pedro da Silva;f9a533f2c78e4a09f87c9e68e442d3fe
Sint cumque consequuntur quos;Tarefa a Ser Feita;2;2025-01-06 17:59:29;;3;Cancelado;Jeferson Klau;b4853fc1f03a3a4cec530a98a94d89ad
Comprar veritatis;Item de Compra;1;2024-07-16 19:58:20;;1;A Fazer;Jeferson Klau;b4853fc1f03a3a4cec530a98a94d89ad
Comprar explicabo;Item de Compra;1;2024-11-03 02:59:19;2025-02-10 02:59:19;2;Concluído;Jeferson Klau;b4853fc1f03a3a4cec530a98a94d89ad
Error blanditiis officiis eum reprehenderit officiis perspiciatis;Tarefa a Ser Feita;2;2024-02-27 12:40:20;;3;Cancelado;Jeferson Klau;b4853fc1f03a3a4cec530a98a94d89ad
Comprar ipsa;Item de Compra;1;2023-10-16 04:37:15;2023-11-09 04:37:15;2;Concluído;Pedro da Silva;f9a533f2c78e4a09f87c9e68e442d3fe
Esse cumque perferendis eligendi expedita deleniti quam aperiam;Tarefa a Ser Feita;2;2024-09-29 15:37:50;;1;A Fazer;Pedro da Silva;f9a533f2c78e4a09f87c9e68e442d3fe
Comprar dicta;Item de Compra;1;2025-03-26 13:05:21;;1;A Fazer;Jeferson Klau;b4853fc1f03a3a4cec530a98a94d89ad
Cupiditate iure;Tarefa a Ser Feita;2;2024-01-03 16:56:12;;3;Cancelado;Pedro da Silva;f9a533f2c78e4a09f87c9e68e442d3fe
Magni praesentium consequuntur;Tarefa a Ser Feita;2;2024-01-31 22:05:01;;3;Cancelado;Pedro da Silva;f9a533f2c78e4a09f87c9e68e442d3fe
Comprar cumque;Item de Compra;1;2024-07-04 11:04:34;;3;Cancelado;Pedro da Silva;f9a533f2c78e4a09f87c9e68e442d3fe
Sit ullam corporis voluptatibus eligendi reiciendis;Tarefa a Ser Feita;2;2024-02-07 18:32:04;2024-07-15 18:32:04;2;Concluído;Pedro da Silva;f9a533f2c78e4a09f87c9e68e442d3fe
Quia esse enim quis officia iste ad;Tarefa a Ser Feita;2;2024-08-05 13:12:17;2025-06-02 21:18:40;2;Concluído;Pedro da Silva;f9a533f2c78e4a09f87c9e68e442d3fe
Comprar veritatis;Item de Compra;1;2025-02-02 05:31:57;2025-05-27 05:31:57;2;Concluído;Jeferson Klau;b4853fc1f03a3a4cec530a98a94d89ad
Recusandae soluta;Tarefa a Ser Feita;2;2023-07-10 19:01:48;2023-11-01 19:01:48;2;Concluído;Pedro da Silva;f9a533f2c78e4a09f87c9e68e442d3fe
Eius quia eos eos;Tarefa a Ser Feita;2;2023-11-15 14:50:19;;1;A Fazer;Jeferson Klau;b4853fc1f03a3a4cec530a98a94d89ad
Provident nisi;Tarefa a Ser Feita;2;2024-10-22 10:08:31;;3;Cancelado;Jeferson Klau;b4853fc1f03a3a4cec530a98a94d89ad
Enim aperiam cum;Tarefa a Ser Feita;2;2025-05-10 08:01:12;;1;A Fazer;Pedro da Silva;f9a533f2c78e4a09f87c9e68e442d3fe
Comprar tenetur;Item de Compra;1;2023-10-21 03:25:25;;1;A Fazer;Pedro da Silva;f9a533f2c78e4a09f87c9e68e442d3fe
Quia illum error;Tarefa a Ser Feita;2;2023-08-12 03:06:12;2023-09-01 03:06:12;2;Concluído;Jeferson Klau;b4853fc1f03a3a4cec530a98a94d89ad
Velit nemo fugiat quod;Tarefa a Ser Feita;2;2025-03-03 03:08:34;;1;A Fazer;Pedro da Silva;f9a533f2c78e4a09f87c9e68e442d3fe
Officia atque sapiente nisi;Tarefa a Ser Feita;2;2024-02-06 14:38:33;;3;Cancelado;Pedro da Silva;f9a533f2c78e4a09f87c9e68e442d3fe
Comprar non;Item de Compra;1;2023-10-11 15:11:23;;3;Cancelado;Jeferson Klau;b4853fc1f03a3a4cec530a98a94d89ad
Exercitationem earum quas velit quod;Tarefa a Ser Feita;2;2023-11-08 13:28:51;2023-12-08 13:28:51;2;Concluído;Pedro da Silva;f9a533f2c78e4a09f87c9e68e442d3fe
Optio ut officiis;Tarefa a Ser Feita;2;2023-07-08 01:25:51;;3;Cancelado;Jeferson Klau;b4853fc1f03a3a4cec530a98a94d89ad
Comprar quasi;Item de Compra;1;2024-06-23 20:25:39;;3;Cancelado;Jeferson Klau;b4853fc1f03a3a4cec530a98a94d89ad
Dolore in explicabo mollitia dolorum;Tarefa a Ser Feita;2;2023-07-14 20:48:54;2024-03-24 20:48:54;2;Concluído;Jeferson Klau;b4853fc1f03a3a4cec530a98a94d89ad
Comprar ex;Item de Compra;1;2023-07-20 08:48:40;;1;A Fazer;Pedro da Silva;f9a533f2c78e4a09f87c9e68e442d3fe
Illo et dolorem distinctio deleniti;Tarefa a Ser Feita;2;2024-10-07 07:10:45;2025-06-02 21:16:40;2;Concluído;Jeferson Klau;b4853fc1f03a3a4cec530a98a94d89ad
Aperiam repudiandae ipsam hic amet;Tarefa a Ser Feita;2;2024-12-14 09:58:55;;3;Cancelado;Jeferson Klau;b4853fc1f03a3a4cec530a98a94d89ad
Officia eaque illum dicta reprehenderit aut alias;Tarefa a Ser Feita;2;2025-02-19 02:46:26;2025-06-02 21:12:40;2;Concluído;Jeferson Klau;b4853fc1f03a3a4cec530a98a94d89ad
Eum in molestiae;Tarefa a Ser Feita;2;2023-12-11 22:34:03;;3;Cancelado;Jeferson Klau;b4853fc1f03a3a4cec530a98a94d89ad
Maxime at officia;Tarefa a Ser Feita;2;2024-06-18 07:51:23;2025-05-10 07:51:23;2;Concluído;Pedro da Silva;f9a533f2c78e4a09f87c9e68e442d3fe
Ex labore excepturi consequatur tempore;Tarefa a Ser Feita;2;2024-01-22 04:33:33;;1;A Fazer;Pedro da Silva;f9a533f2c78e4a09f87c9e68e442d3fe
Quidem nostrum quos iure aspernatur laudantium veniam;Tarefa a Ser Feita;2;2025-05-16 23:37:51;;3;Cancelado;Pedro da Silva;f9a533f2c78e4a09f87c9e68e442d3fe
Sunt ducimus quaerat harum;Tarefa a Ser Feita;2;2024-01-05 08:07:23;2024-07-05 08:07:23;2;Concluído;Pedro da Silva;f9a533f2c78e4a09f87c9e68e442d3fe
Voluptate non ipsum delectus corporis numquam;Tarefa a Ser Feita;2;2024-04-06 14:38:00;;1;A Fazer;Jeferson Klau;b4853fc1f03a3a4cec530a98a94d89ad
Neque aliquid maxime velit;Tarefa a Ser Feita;2;2024-05-10 21:10:43;2024-08-13 21:10:43;2;Concluído;Pedro da Silva;f9a533f2c78e4a09f87c9e68e442d3fe
Incidunt sed consequuntur totam dignissimos et minima;Tarefa a Ser Feita;2;2024-07-28 13:36:28;;3;Cancelado;Pedro da Silva;f9a533f2c78e4a09f87c9e68e442d3fe
Ullam nulla rem eaque optio nulla;Tarefa a Ser Feita;2;2024-09-01 01:11:48;2025-06-02 21:02:40;2;Concluído;Pedro da Silva;f9a533f2c78e4a09f87c9e68e442d3fe
Similique quaerat;Tarefa a Ser Feita;2;2025-03-24 18:05:19;;3;Cancelado;Jeferson Klau;b4853fc1f03a3a4cec530a98a94d89ad
Ab voluptates necessitatibus totam enim magni quos;Tarefa a Ser Feita;2;2023-12-15 18:26:13;;1;A Fazer;Pedro da Silva;f9a533f2c78e4a09f87c9e68e442d3fe
Sint doloribus eaque dignissimos alias voluptatum;Tarefa a Ser Feita;2;2024-01-14 11:50:15;;3;Cancelado;Jeferson Klau;b4853fc1f03a3a4cec530a98a94d89ad
Placeat expedita labore ab;Tarefa a Ser Feita;2;2023-06-16 00:52:11;;3;Cancelado;Jeferson Klau;b4853fc1f03a3a4cec530a98a94d89ad
Comprar nostrum;Item de Compra;1;2024-09-03 18:05:00;2025-02-09 18:05:00;2;Concluído;Pedro da Silva;f9a533f2c78e4a09f87c9e68e442d3fe
Voluptatem possimus aut;Tarefa a Ser Feita;2;2023-10-30 17:16:05;;3;Cancelado;Pedro da Silva;f9a533f2c78e4a09f87c9e68e442d3fe
Nihil non deserunt ut;Tarefa a Ser Feita;2;2024-05-02 23:44:13;;3;Cancelado;Jeferson Klau;b4853fc1f03a3a4cec530a98a94d89ad
Quam officia nostrum voluptates sint sunt;Tarefa a Ser Feita;2;2024-02-04 11:37:38;;1;A Fazer;Pedro da Silva;f9a533f2c78e4a09f87c9e68e442d3fe
Laborum nulla tenetur commodi;Tarefa a Ser Feita;2;2024-01-13 13:25:40;;3;Cancelado;Jeferson Klau;b4853fc1f03a3a4cec530a98a94d89ad
Inventore sapiente quod assumenda;Tarefa a Ser Feita;2;2024-07-11 12:07:30;;3;Cancelado;Jeferson Klau;b4853fc1f03a3a4cec530a98a94d89ad
Assumenda inventore quaerat totam occaecati;Tarefa a Ser Feita;2;2024-12-26 08:49:30;;1;A Fazer;Jeferson Klau;b4853fc1f03a3a4cec530a98a94d89ad
Nobis quidem eos odit non animi;Tarefa a Ser Feita;2;2024-03-21 22:59:45;;1;A Fazer;Jeferson Klau;b4853fc1f03a3a4cec530a98a94d89ad
Dicta sapiente iusto;Tarefa a Ser Feita;2;2025-02-10 08:55:54;;1;A Fazer;Jeferson Klau;b4853fc1f03a3a4cec530a98a94d89ad
Amet voluptatibus deserunt assumenda;Tarefa a Ser Feita;2;2023-12-12 16:22:23;2024-11-04 16:22:23;2;Concluído;Pedro da Silva;f9a533f2c78e4a09f87c9e68e442d3fe
Nemo consectetur placeat iste;Tarefa a Ser Feita;2;2024-09-24 18:31:42;2025-06-02 21:13:40;2;Concluído;Pedro da Silva;f9a533f2c78e4a09f87c9e68e442d3fe
Natus quaerat suscipit;Tarefa a Ser Feita;2;2024-09-24 13:14:20;;3;Cancelado;Jeferson Klau;b4853fc1f03a3a4cec530a98a94d89ad
Nemo laboriosam;Tarefa a Ser Feita;2;2023-07-31 20:35:10;;1;A Fazer;Jeferson Klau;b4853fc1f03a3a4cec530a98a94d89ad
Comprar tempore;Item de Compra;1;2025-02-04 20:32:27;;1;A Fazer;Pedro da Silva;f9a533f2c78e4a09f87c9e68e442d3fe
Laboriosam ipsa facilis;Tarefa a Ser Feita;2;2024-03-03 04:46:03;2024-04-21 04:46:03;2;Concluído;Jeferson Klau;b4853fc1f03a3a4cec530a98a94d89ad
Similique similique iure sed;Tarefa a Ser Feita;2;2024-08-30 02:29:11;;3;Cancelado;Jeferson Klau;b4853fc1f03a3a4cec530a98a94d89ad
Comprar in;Item de Compra;1;2024-04-19 22:23:39;2024-07-17 22:23:39;2;Concluído;Jeferson Klau;b4853fc1f03a3a4cec530a98a94d89ad
Odit ducimus;Tarefa a Ser Feita;2;2024-11-15 13:26:39;;3;Cancelado;Pedro da Silva;f9a533f2c78e4a09f87c9e68e442d3fe
Blanditiis similique eligendi quidem;Tarefa a Ser Feita;2;2025-03-13 11:12:36;;3;Cancelado;Pedro da Silva;f9a533f2c78e4a09f87c9e68e442d3fe
Aliquid magnam;Tarefa a Ser Feita;2;2025-03-19 13:35:28;2025-06-02 21:40:40;2;Concluído;Pedro da Silva;f9a533f2c78e4a09f87c9e68e442d3fe
Comprar facilis;Item de Compra;1;2023-07-19 11:17:35;;3;Cancelado;Pedro da Silva;f9a533f2c78e4a09f87c9e68e442d3fe
Omnis totam voluptates atque nesciunt eius laboriosam;Tarefa a Ser Feita;2;2024-12-12 06:56:59;2025-06-02 21:27:40;2;Concluído;Jeferson Klau;b4853fc1f03a3a4cec530a98a94d89ad
Similique amet nostrum;Tarefa a Ser Feita;2;2023-12-27 20:49:37;;1;A Fazer;Pedro da Silva;f9a533f2c78e4a09f87c9e68e442d3fe
Comprar soluta;Item de Compra;1;2023-09-28 00:35:59;;1;A Fazer;Jeferson Klau;b4853fc1f03a3a4cec530a98a94d89ad
Distinctio minima necessitatibus;Tarefa a Ser Feita;2;2023-10-20 21:49:14;;1;A Fazer;Pedro da Silva;f9a533f2c78e4a09f87c9e68e442d3fe
