Nome da Tarefa;Tipo da Tarefa;Tipo da Tarefa ID;Data de Criação;Data de Conclusão;Status;Status Descrição;Usuário;ID do Usuário
Cum iure exercitationem laboriosam;Tarefa a Ser Feita;2;2024-07-18 22:51:51;2025-02-12 22:51:51;2;Concluído;Jeferson Klau;b4853fc1f03a3a4cec530a98a94d89ad
Recusandae quasi;Tarefa a Ser Feita;2;2024-01-09 21:03:53;;3;Cancelado;Pedro da Silva;f9a533f2c78e4a09f87c9e68e442d3fe
Temporibus aperiam;Tarefa a Ser Feita;2;2024-08-24 04:40:10;;3;Cancelado;Pedro da Silva;f9a533f2c78e4a09f87c9e68e442d3fe
Impedit laboriosam sed exercitationem voluptas ab fugit;Tarefa a Ser Feita;2;2024-10-16 21:40:59;;3;Cancelado;Jeferson Klau;b4853fc1f03a3a4cec530a98a94d89ad
Asperiores iusto;Tarefa a Ser Feita;2;2025-05-29 09:07:49;;1;A Fazer;Jeferson Klau;b4853fc1f03a3a4cec530a98a94d89ad
Asperiores pariatur voluptatibus magnam;Tarefa a Ser Feita;2;2023-09-12 19:56:45;;1;A Fazer;Jeferson Klau;b4853fc1f03a3a4cec530a98a94d89ad
Comprar aliquam;Item de Compra;1;2024-02-18 16:05:27;2024-09-10 16:05:27;2;Concluído;Pedro da Silva;f9a533f2c78e4a09f87c9e68e442d3fe
Comprar ipsa;Item de Compra;1;2024-11-27 13:01:39;2025-02-08 13:01:39;2;Concluído;Jeferson Klau;b4853fc1f03a3a4cec530a98a94d89ad
Comprar maiores;Item de Compra;1;2023-11-26 23:54:03;;1;A Fazer;Pedro da Silva;f9a533f2c78e4a09f87c9e68e442d3fe
Perspiciatis velit saepe modi;Tarefa a Ser Feita;2;2025-03-19 00:16:40;2025-06-02 20:57:40;2;Concluído;Pedro da Silva;f9a533f2c78e4a09f87c9e68e442d3fe
Comprar asperiores;Item de Compra;1;2025-04-01 19:03:43;2025-06-02 21:04:40;2;Concluído;Pedro da Silva;f9a533f2c78e4a09f87c9e68e442d3fe
Comprar tempore;Item de Compra;1;2023-06-26 06:33:23;2024-06-15 06:33:23;2;Concluído;Jeferson Klau;b4853fc1f03a3a4cec530a98a94d89ad
Laboriosam dolor;Tarefa a Ser Feita;2;2023-08-27 09:30:37;;1;A Fazer;Jeferson Klau;b4853fc1f03a3a4cec530a98a94d89ad
Eius odio consectetur ipsa quasi;Tarefa a Ser Feita;2;2025-01-11 23:59:13;2025-02-23 23:59:13;2;Concluído;Pedro da Silva;f9a533f2c78e4a09f87c9e68e442d3fe
Blanditiis corrupti quasi;Tarefa a Ser Feita;2;2025-02-05 16:57:46;;1;A Fazer;Jeferson Klau;b4853fc1f03a3a4cec530a98a94d89ad
Comprar eius;Item de Compra;1;2024-10-08 06:35:53;;3;Cancelado;Pedro da Silva;f9a533f2c78e4a09f87c9e68e442d3fe
Incidunt quia;Tarefa a Ser Feita;2;2023-06-20 03:57:07;;3;Cancelado;Jeferson Klau;b4853fc1f03a3a4cec530a98a94d89ad
Facilis possimus quo deleniti rem;Tarefa a Ser Feita;2;2023-12-23 12:30:49;2024-07-28 12:30:49;2;Concluído;Pedro da Silva;f9a533f2c78e4a09f87c9e68e442d3fe
Veritatis accusantium dolor consequuntur;Tarefa a Ser Feita;2;2025-02-01 04:33:54;2025-06-02 21:20:40;2;Concluído;Pedro da Silva;f9a533f2c78e4a09f87c9e68e442d3fe
Totam accusantium omnis occaecati debitis;Tarefa a Ser Feita;2;2024-10-30 03:05:27;2025-06-02 21:37:40;2;Concluído;Pedro da Silva;f9a533f2c78e4a09f87c9e68e442d3fe
Eveniet corrupti possimus;Tarefa a Ser Feita;2;2024-05-15 06:00:23;2024-08-01 06:00:23;2;Concluído;Pedro da Silva;f9a533f2c78e4a09f87c9e68e442d3fe
Veniam alias reiciendis perferendis porro nisi;Tarefa a Ser Feita;2;2024-04-18 01:05:46;;3;Cancelado;Jeferson Klau;b4853fc1f03a3a4cec530a98a94d89ad
Dolores molestiae nulla;Tarefa a Ser Feita;2;2024-05-02 02:41:28;;1;A Fazer;Pedro da Silva;f9a533f2c78e4a09f87c9e68e442d3fe
Comprar consectetur;Item de Compra;1;2023-06-14 15:29:12;;1;A Fazer;Pedro da Silva;f9a533f2c78e4a09f87c9e68e442d3fe
Comprar esse;Item de Compra;1;2025-02-13 11:13:26;2025-06-02 20:48:40;2;Concluído;Jeferson Klau;b4853fc1f03a3a4cec530a98a94d89ad
Sunt soluta officia quam nesciunt;Tarefa a Ser Feita;2;2024-03-31 16:41:51;;1;A Fazer;Jeferson Klau;b4853fc1f03a3a4cec530a98a94d89ad
Dolor dignissimos voluptatum aliquam iure at;Tarefa a Ser Feita;2;2023-06-04 20:14:50;2023-07-24 20:14:50;2;Concluído;Pedro da Silva;f9a533f2c78e4a09f87c9e68e442d3fe
Comprar voluptatibus;Item de Compra;1;2024-01-05 17:12:06;2024-05-19 17:12:06;2;Concluído;Pedro da Silva;f9a533f2c78e4a09f87c9e68e442d3fe
Voluptates quo itaque libero aliquid;Tarefa a Ser Feita;2;2023-12-27 15:01:38;;1;A Fazer;Pedro da Silva;f9a533f2c78e4a09f87c9e68e442d3fe
Consectetur aliquid doloribus aut ex pariatur;Tarefa a Ser Feita;2;2024-05-04 17:06:57;2024-10-11 17:06:57;2;Concluído;Pedro da Silva;f9a533f2c78e4a09f87c9e68e442d3fe
Comprar soluta;Item de Compra;1;2023-08-16 07:44:27;;3;Cancelado;Jeferson Klau;b4853fc1f03a3a4cec530a98a94d89ad
Comprar recusandae;Item de Compra;1;2023-06-17 15:18:56;;1;A Fazer;Pedro da Silva;f9a533f2c78e4a09f87c9e68e442d3fe
Quos maxime;Tarefa a Ser Feita;2;2024-04-23 06:46:22;;3;Cancelado;Pedro da Silva;f9a533f2c78e4a09f87c9e68e442d3fe
Comprar sequi;Item de Compra;1;2025-02-05 09:04:41;;3;Cancelado;Pedro da Silva;f9a533f2c78e4a09f87c9e68e442d3fe
Comprar ab;Item de Compra;1;2024-11-12 11:14:24;;1;A Fazer;Jeferson Klau;b4853fc1f03a3a4cec530a98a94d89ad
Amet beatae esse;Tarefa a Ser Feita;2;2024-02-10 16:00:34;2024-02-14 16:00:34;2;Concluído;Jeferson Klau;b4853fc1f03a3a4cec530a98a94d89ad
Comprar ex;Item de Compra;1;2025-04-22 19:25:47;;3;Cancelado;Pedro da Silva;f9a533f2c78e4a09f87c9e68e442d3fe
Modi;Tarefa a Ser Feita;2;2025-03-12 12:43:39;;1;A Fazer;Jeferson Klau;b4853fc1f03a3a4cec530a98a94d89ad
Necessitatibus consequatur;Tarefa a Ser Feita;2;2025-04-10 19:57:49;;3;Cancelado;Jeferson Klau;b4853fc1f03a3a4cec530a98a94d89ad
Comprar quaerat;Item de Compra;1;2024-05-02 08:43:51;;1;A Fazer;Pedro da Silva;f9a533f2c78e4a09f87c9e68e442d3fe
Adipisci earum quia;Tarefa a Ser Feita;2;2023-09-29 02:31:31;;3;Cancelado;Pedro da Silva;f9a533f2c78e4a09f87c9e68e442d3fe
Comprar sed;Item de Compra;1;2025-05-25 23:04:16;;1;A Fazer;Jeferson Klau;b4853fc1f03a3a4cec530a98a94d89ad
Comprar ullam;Item de Compra;1;2024-09-21 07:48:24;2025-01-25 07:48:24;2;Concluído;Jeferson Klau;b4853fc1f03a3a4cec530a98a94d89ad
Comprar nam;Item de Compra;1;2023-08-30 15:21:14;;3;Cancelado;Jeferson Klau;b4853fc1f03a3a4cec530a98a94d89ad
Ipsa accusantium voluptate;Tarefa a Ser Feita;2;2024-05-19 03:14:54;2025-01-12 03:14:54;2;Concluído;Jeferson Klau;b4853fc1f03a3a4cec530a98a94d89ad
Nostrum consequuntur eveniet doloribus quasi ducimus;Tarefa a Ser Feita;2;2024-01-16 11:41:27;;3;Cancelado;Jeferson Klau;b4853fc1f03a3a4cec530a98a94d89ad
Doloremque excepturi repellendus ad iusto aut;Tarefa a Ser Feita;2;2024-07-10 18:55:09;2025-01-16 18:55:09;2;Concluído;Jeferson Klau;b4853fc1f03a3a4cec530a98a94d89ad
Placeat perspiciatis doloribus dolore;Tarefa a Ser Feita;2;2024-08-10 01:09:03;;3;Cancelado;Jeferson Klau;b4853fc1f03a3a4cec530a98a94d89ad
Ad iusto culpa;Tarefa a Ser Feita;2;2023-12-16 05:13:08;;1;A Fazer;Jeferson Klau;b4853fc1f03a3a4cec530a98a94d89ad
Illo laboriosam iusto asperiores;Tarefa a Ser Feita;2;2023-10-10 18:12:34;;3;Cancelado;Pedro da Silva;f9a533f2c78e4a09f87c9e68e442d3fe
Rerum animi ducimus vel;Tarefa a Ser Feita;2;2024-10-10 04:20:59;2024-12-13 04:20:59;2;Concluído;Jeferson Klau;b4853fc1f03a3a4cec530a98a94d89ad
Comprar laboriosam;Item de Compra;1;2024-11-08 11:56:51;;1;A Fazer;Pedro da Silva;f9a533f2c78e4a09f87c9e68e442d3fe
Maxime nesciunt expedita totam;Tarefa a Ser Feita;2;2023-08-18 16:34:57;;1;A Fazer;Pedro da Silva;f9a533f2c78e4a09f87c9e68e442d3fe
Explicabo dolor;Tarefa a Ser Feita;2;2024-01-09 02:10:09;2024-11-23 02:10:09;2;Concluído;Pedro da Silva;f9a533f2c78e4a09f87c9e68e442d3fe
Repellat aperiam quisquam saepe quia ipsum aut placeat sequi;Tarefa a Ser Feita;2;2024-03-02 15:40:32;;3;Cancelado;Pedro da Silva;f9a533f2c78e4a09f87c9e68e442d3fe
Comprar aspernatur;Item de Compra;1;2024-03-10 01:25:36;;1;A Fazer;Jeferson Klau;b4853fc1f03a3a4cec530a98a94d89ad
Ad asperiores laudantium quia;Tarefa a Ser Feita;2;2025-03-06 09:54:32;;3;Cancelado;Pedro da Silva;f9a533f2c78e4a09f87c9e68e442d3fe
Fuga quae corporis dignissimos voluptas dolorem ipsa;Tarefa a Ser Feita;2;2024-07-08 13:30:58;;1;A Fazer;Jeferson Klau;b4853fc1f03a3a4cec530a98a94d89ad
Facilis illo quibusdam;Tarefa a Ser Feita;2;2024-02-17 00:48:53;2024-05-26 00:48:53;2;Concluído;Jeferson Klau;b4853fc1f03a3a4cec530a98a94d89ad
Minus quisquam quae;Tarefa a Ser Feita;2;2024-12-07 15:53:54;2025-06-02 21:02:40;2;Concluído;Jeferson Klau;b4853fc1f03a3a4cec530a98a94d89ad
Delectus cum aut rem earum;Tarefa a Ser Feita;2;2023-12-31 11:54:55;2024-06-10 11:54:55;2;Concluído;Jeferson Klau;b4853fc1f03a3a4cec530a98a94d89ad
Voluptas reprehenderit assumenda unde ipsa;Tarefa a Ser Feita;2;2025-05-24 21:48:37;;1;A Fazer;Pedro da Silva;f9a533f2c78e4a09f87c9e68e442d3fe
Nobis fugit earum enim quo ipsa;Tarefa a Ser Feita;2;2025-05-09 03:37:11;;1;A Fazer;Jeferson Klau;b4853fc1f03a3a4cec530a98a94d89ad
Provident veniam suscipit aperiam sint;Tarefa a Ser Feita;2;2024-05-24 05:55:44;;3;Cancelado;Jeferson Klau;b4853fc1f03a3a4cec530a98a94d89ad
Consequuntur blanditiis libero;Tarefa a Ser Feita;2;2024-05-13 09:40:12;;3;Cancelado;Pedro da Silva;f9a533f2c78e4a09f87c9e68e442d3fe
Eius perspiciatis;Tarefa a Ser Feita;2;2025-05-08 19:58:47;2025-06-02 20:51:40;2;Concluído;Pedro da Silva;f9a533f2c78e4a09f87c9e68e442d3fe
Comprar facilis;Item de Compra;1;2024-05-01 18:29:54;;3;Cancelado;Jeferson Klau;b4853fc1f03a3a4cec530a98a94d89ad
Optio magni provident velit reprehenderit qui atque;Tarefa a Ser Feita;2;2024-10-16 00:48:34;;3;Cancelado;Pedro da Silva;f9a533f2c78e4a09f87c9e68e442d3fe
Comprar quod;Item de Compra;1;2025-03-19 18:12:50;2025-06-02 21:46:40;2;Concluído;Pedro da Silva;f9a533f2c78e4a09f87c9e68e442d3fe
Atque nostrum eveniet aperiam;Tarefa a Ser Feita;2;2023-12-07 12:50:15;2024-04-17 12:50:15;2;Concluído;Jeferson Klau;b4853fc1f03a3a4cec530a98a94d89ad
Natus cum voluptas accusamus assumenda magni;Tarefa a Ser Feita;2;2024-10-18 10:59:40;2024-12-31 10:59:40;2;Concluído;Jeferson Klau;b4853fc1f03a3a4cec530a98a94d89ad
Consectetur iusto voluptatem;Tarefa a Ser Feita;2;2025-05-15 16:24:04;;3;Cancelado;Pedro da Silva;f9a533f2c78e4a09f87c9e68e442d3fe
Dolore harum quos omnis maxime facilis;Tarefa a Ser Feita;2;2023-10-15 16:00:05;;1;A Fazer;Jeferson Klau;b4853fc1f03a3a4cec530a98a94d89ad
Fuga ipsam autem alias commodi;Tarefa a Ser Feita;2;2024-06-03 20:29:11;;1;A Fazer;Jeferson Klau;b4853fc1f03a3a4cec530a98a94d89ad
Facilis non;Tarefa a Ser Feita;2;2024-04-13 01:45:27;2025-03-03 01:45:27;2;Concluído;Jeferson Klau;b4853fc1f03a3a4cec530a98a94d89ad
Laborum tempora soluta;Tarefa a Ser Feita;2;2024-11-11 21:51:32;;3;Cancelado;Pedro da Silva;f9a533f2c78e4a09f87c9e68e442d3fe
Quis voluptatem;Tarefa a Ser Feita;2;2024-11-26 01:43:12;;1;A Fazer;Jeferson Klau;b4853fc1f03a3a4cec530a98a94d89ad
Hic officiis vitae;Tarefa a Ser Feita;2;2023-10-08 06:55:45;;3;Cancelado;Jeferson Klau;b4853fc1f03a3a4cec530a98a94d89ad
Comprar aut;Item de Compra;1;2023-10-19 23:56:19;;1;A Fazer;Pedro da Silva;f9a533f2c78e4a09f87c9e68e442d3fe
Comprar aperiam;Item de Compra;1;2023-11-19 22:17:27;;3;Cancelado;Pedro da Silva;f9a533f2c78e4a09f87c9e68e442d3fe
Comprar nam;Item de Compra;1;2024-03-27 12:38:46;;3;Cancelado;Jeferson Klau;b4853fc1f03a3a4cec530a98a94d89ad
Comprar ea;Item de Compra;1;2025-05-21 13:34:09;2025-06-02 20:52:40;2;Concluído;Pedro da Silva;f9a533f2c78e4a09f87c9e68e442d3fe
Praesentium magnam veniam fugiat necessitatibus;Tarefa a Ser Feita;2;2023-08-10 03:50:33;;3;Cancelado;Pedro da Silva;f9a533f2c78e4a09f87c9e68e442d3fe
Sunt beatae;Tarefa a Ser Feita;2;2023-06-19 12:57:21;2024-01-30 12:57:21;2;Concluído;Jeferson Klau;b4853fc1f03a3a4cec530a98a94d89ad
Comprar voluptatum;Item de Compra;1;2024-07-25 01:51:28;2025-04-13 01:51:28;2;Concluído;Jeferson Klau;b4853fc1f03a3a4cec530a98a94d89ad
Autem architecto;Tarefa a Ser Feita;2;2024-09-23 20:49:35;;3;Cancelado;Jeferson Klau;b4853fc1f03a3a4cec530a98a94d89ad
Comprar doloribus;Item de Compra;1;2024-04-01 00:29:52;;1;A Fazer;Pedro da Silva;f9a533f2c78e4a09f87c9e68e442d3fe
Comprar adipisci;Item de Compra;1;2023-11-22 12:32:34;;3;Cancelado;Jeferson Klau;b4853fc1f03a3a4cec530a98a94d89ad
Ipsum doloremque officiis ipsa assumenda sint;Tarefa a Ser Feita;2;2025-03-22 23:24:50;2025-06-02 20:50:40;2;Concluído;Jeferson Klau;b4853fc1f03a3a4cec530a98a94d89ad
Comprar vitae;Item de Compra;1;2024-11-21 22:29:32;;1;A Fazer;Pedro da Silva;f9a533f2c78e4a09f87c9e68e442d3fe
Beatae architecto nam;Tarefa a Ser Feita;2;2024-10-05 00:03:48;;1;A Fazer;Jeferson Klau;b4853fc1f03a3a4cec530a98a94d89ad
Beatae quo voluptates consectetur non;Tarefa a Ser Feita;2;2024-06-29 12:24:01;;3;Cancelado;Jeferson Klau;b4853fc1f03a3a4cec530a98a94d89ad
Voluptates minima doloremque ratione;Tarefa a Ser Feita;2;2023-10-11 09:11:00;;1;A Fazer;Pedro da Silva;f9a533f2c78e4a09f87c9e68e442d3fe
Nihil ullam mollitia nobis atque;Tarefa a Ser Feita;2;2024-10-24 03:58:26;2025-06-02 21:41:40;2;Concluído;Jeferson Klau;b4853fc1f03a3a4cec530a98a94d89ad
Comprar occaecati;Item de Compra;1;2023-09-21 14:34:16;2024-02-11 14:34:16;2;Concluído;Jeferson Klau;b4853fc1f03a3a4cec530a98a94d89ad
Dolore eligendi excepturi;Tarefa a Ser Feita;2;2023-08-25 04:18:12;;3;Cancelado;Pedro da Silva;f9a533f2c78e4a09f87c9e68e442d3fe
Ducimus et repellendus;Tarefa a Ser Feita;2;2024-01-29 18:00:24;2024-02-02 18:00:24;2;Concluído;Pedro da Silva;f9a533f2c78e4a09f87c9e68e442d3fe
Pariatur saepe temporibus mollitia qui inventore omnis;Tarefa a Ser Feita;2;2024-02-11 03:18:52;2024-10-23 03:18:52;2;Concluído;Jeferson Klau;b4853fc1f03a3a4cec530a98a94d89ad
Dolore aperiam at vitae tempora veniam nam consequuntur;Tarefa a Ser Feita;2;2023-09-16 12:00:31;;3;Cancelado;Jeferson Klau;b4853fc1f03a3a4cec530a98a94d89ad
Quaerat nisi repudiandae;Tarefa a Ser Feita;2;2023-12-02 00:19:10;;3;Cancelado;Pedro da Silva;f9a533f2c78e4a09f87c9e68e442d3fe
Delectus totam rem a;Tarefa a Ser Feita;2;2024-02-13 10:16:13;;1;A Fazer;Pedro da Silva;f9a533f2c78e4a09f87c9e68e442d3fe
Reiciendis error natus ad ipsam facere;Tarefa a Ser Feita;2;2024-03-09 20:18:24;;3;Cancelado;Jeferson Klau;b4853fc1f03a3a4cec530a98a94d89ad
Comprar ipsa;Item de Compra;1;2025-02-20 21:01:47;2025-06-02 21:20:40;2;Concluído;Pedro da Silva;f9a533f2c78e4a09f87c9e68e442d3fe
Pariatur rem ipsa odio soluta;Tarefa a Ser Feita;2;2024-10-08 09:27:49;;3;Cancelado;Jeferson Klau;b4853fc1f03a3a4cec530a98a94d89ad
Velit sequi repudiandae quasi porro rerum corporis et;Tarefa a Ser Feita;2;2024-06-17 03:49:10;;1;A Fazer;Pedro da Silva;f9a533f2c78e4a09f87c9e68e442d3fe
Excepturi corporis id sed;Tarefa a Ser Feita;2;2024-06-14 07:56:40;;3;Cancelado;Jeferson Klau;b4853fc1f03a3a4cec530a98a94d89ad
Cupiditate molestias aliquid ducimus provident rerum quae;Tarefa a Ser Feita;2;2023-10-08 17:54:36;;1;A Fazer;Pedro da Silva;f9a533f2c78e4a09f87c9e68e442d3fe
Repellendus iusto error;Tarefa a Ser Feita;2;2024-01-25 01:06:34;2024-10-31 01:06:34;2;Concluído;Pedro da Silva;f9a533f2c78e4a09f87c9e68e442d3fe
Comprar magnam;Item de Compra;1;2023-06-24 00:04:31;2023-09-03 00:04:31;2;Concluído;Jeferson Klau;b4853fc1f03a3a4cec530a98a94d89ad
Quaerat repellendus dolorem corporis;Tarefa a Ser Feita;2;2024-06-24 23:21:04;2024-07-31 23:21:04;2;Concluído;Jeferson Klau;b4853fc1f03a3a4cec530a98a94d89ad
Accusantium odit asperiores vitae distinctio perspiciatis;Tarefa a Ser Feita;2;2023-08-29 10:10:49;;3;Cancelado;Jeferson Klau;b4853fc1f03a3a4cec530a98a94d89ad
Voluptas fuga sequi impedit eaque iure dolor neque;Tarefa a Ser Feita;2;2023-06-05 15:22:43;2023-11-22 15:22:43;2;Concluído;Jeferson Klau;b4853fc1f03a3a4cec530a98a94d89ad
Rem ad corporis molestiae;Tarefa a Ser Feita;2;2024-11-01 23:29:54;2024-11-19 23:29:54;2;Concluído;Pedro da Silva;f9a533f2c78e4a09f87c9e68e442d3fe
Comprar beatae;Item de Compra;1;2024-04-20 08:29:54;;1;A Fazer;Jeferson Klau;b4853fc1f03a3a4cec530a98a94d89ad
Unde quo quae suscipit tenetur nesciunt quidem;Tarefa a Ser Feita;2;2024-06-01 16:11:58;2024-06-29 16:11:58;2;Concluído;Pedro da Silva;f9a533f2c78e4a09f87c9e68e442d3fe
Magni quos totam distinctio vero eum delectus;Tarefa a Ser Feita;2;2025-01-30 18:50:32;;3;Cancelado;Jeferson Klau;b4853fc1f03a3a4cec530a98a94d89ad
Voluptate ipsam corporis ea nam natus;Tarefa a Ser Feita;2;2024-07-30 13:07:08;;3;Cancelado;Jeferson Klau;b4853fc1f03a3a4cec530a98a94d89ad
Earum sint quisquam vero labore nostrum;Tarefa a Ser Feita;2;2024-09-13 05:55:11;2025-06-02 21:32:40;2;Concluído;Jeferson Klau;b4853fc1f03a3a4cec530a98a94d89ad
Comprar optio;Item de Compra;1;2023-09-30 18:50:14;;1;A Fazer;Pedro da Silva;f9a533f2c78e4a09f87c9e68e442d3fe
Voluptas vel laborum eos esse velit;Tarefa a Ser Feita;2;2023-08-07 05:57:10;;3;Cancelado;Jeferson Klau;b4853fc1f03a3a4cec530a98a94d89ad
Comprar perferendis;Item de Compra;1;2025-03-03 07:41:03;2025-04-23 07:41:03;2;Concluído;Pedro da Silva;f9a533f2c78e4a09f87c9e68e442d3fe
Repellendus in a quisquam quod ad architecto ipsam;Tarefa a Ser Feita;2;2024-12-04 02:00:02;;1;A Fazer;Jeferson Klau;b4853fc1f03a3a4cec530a98a94d89ad
Explicabo voluptatem libero inventore eaque nesciunt ratione;Tarefa a Ser Feita;2;2024-09-23 16:27:39;;1;A Fazer;Pedro da Silva;f9a533f2c78e4a09f87c9e68e442d3fe
Ut ut animi dolorem;Tarefa a Ser Feita;2;2024-11-02 18:58:37;;1;A Fazer;Jeferson Klau;b4853fc1f03a3a4cec530a98a94d89ad
Possimus;Tarefa a Ser Feita;2;2025-04-17 17:22:27;;1;A Fazer;Jeferson Klau;b4853fc1f03a3a4cec530a98a94d89ad
Amet quas dolor beatae dolorem;Tarefa a Ser Feita;2;2023-12-07 11:36:26;2024-03-16 11:36:26;2;Concluído;Pedro da Silva;f9a533f2c78e4a09f87c9e68e442d3fe
Comprar eveniet;Item de Compra;1;2023-09-08 14:29:23;2024-04-25 14:29:23;2;Concluído;Pedro da Silva;f9a533f2c78e4a09f87c9e68e442d3fe
Quae atque quia;Tarefa a Ser Feita;2;2024-11-06 15:39:01;;1;A Fazer;Jeferson Klau;b4853fc1f03a3a4cec530a98a94d89ad
Comprar unde;Item de Compra;1;2024-09-29 09:50:06;2025-01-12 09:50:06;2;Concluído;Pedro da Silva;f9a533f2c78e4a09f87c9e68e442d3fe
Comprar possimus;Item de Compra;1;2025-01-25 22:30:58;;3;Cancelado;Pedro da Silva;f9a533f2c78e4a09f87c9e68e442d3fe
Comprar eius;Item de Compra;1;2025-04-17 21:58:36;2025-06-02 21:37:40;2;Concluído;Pedro da Silva;f9a533f2c78e4a09f87c9e68e442d3fe
Comprar laborum;Item de Compra;1;2024-01-27 06:49:29;2025-01-03 06:49:29;2;Concluído;Pedro da Silva;f9a533f2c78e4a09f87c9e68e442d3fe
Comprar odit;Item de Compra;1;2024-06-01 08:43:59;;3;Cancelado;Jeferson Klau;b4853fc1f03a3a4cec530a98a94d89ad
Velit modi ullam labore maiores;Tarefa a Ser Feita;2;2023-11-16 09:14:57;;1;A Fazer;Pedro da Silva;f9a533f2c78e4a09f87c9e68e442d3fe
Voluptatem placeat facilis amet ipsum;Tarefa a Ser Feita;2;2024-08-10 00:30:15;;1;A Fazer;Pedro da Silva;f9a533f2c78e4a09f87c9e68e442d3fe
Cupiditate ducimus tempora tempore;Tarefa a Ser Feita;2;2023-07-11 12:34:32;2023-11-23 12:34:32;2;Concluído;Jeferson Klau;b4853fc1f03a3a4cec530a98a94d89ad
Molestias autem repellendus officia;Tarefa a Ser Feita;2;2023-10-11 19:21:35;2023-12-19 19:21:35;2;Concluído;Jeferson Klau;b4853fc1f03a3a4cec530a98a94d89ad
Esse recusandae iusto nihil error possimus minus explicabo;Tarefa a Ser Feita;2;2025-03-05 19:08:31;;1;A Fazer;Pedro da Silva;f9a533f2c78e4a09f87c9e68e442d3fe
Aut perspiciatis;Tarefa a Ser Feita;2;2023-09-29 11:34:43;2023-12-27 11:34:43;2;Concluído;Jeferson Klau;b4853fc1f03a3a4cec530a98a94d89ad
Commodi nobis doloremque;Tarefa a Ser Feita;2;2023-09-12 20:15:26;2024-06-14 20:15:26;2;Concluído;Jeferson Klau;b4853fc1f03a3a4cec530a98a94d89ad
Comprar velit;Item de Compra;1;2024-02-28 05:42:31;2025-01-26 05:42:31;2;Concluído;Pedro da Silva;f9a533f2c78e4a09f87c9e68e442d3fe
Comprar quod;Item de Compra;1;2023-10-01 06:36:04;;1;A Fazer;Pedro da Silva;f9a533f2c78e4a09f87c9e68e442d3fe
Ea veritatis possimus unde;Tarefa a Ser Feita;2;2023-12-10 04:29:57;;3;Cancelado;Pedro da Silva;f9a533f2c78e4a09f87c9e68e442d3fe
Alias deserunt esse;Tarefa a Ser Feita;2;2023-12-23 12:25:14;2024-01-30 12:25:14;2;Concluído;Jeferson Klau;b4853fc1f03a3a4cec530a98a94d89ad
Comprar illo;Item de Compra;1;2024-02-04 19:06:05;2024-05-16 19:06:05;2;Concluído;Jeferson Klau;b4853fc1f03a3a4cec530a98a94d89ad
Fuga quibusdam adipisci hic;Tarefa a Ser Feita;2;2025-04-24 04:36:03;;3;Cancelado;Pedro da Silva;f9a533f2c78e4a09f87c9e68e442d3fe
Sunt quia quasi error dolores eaque;Tarefa a Ser Feita;2;2023-07-29 11:33:32;2024-07-25 11:33:32;2;Concluído;Jeferson Klau;b4853fc1f03a3a4cec530a98a94d89ad
Explicabo quis;Tarefa a Ser Feita;2;2024-05-15 01:24:37;;1;A Fazer;Jeferson Klau;b4853fc1f03a3a4cec530a98a94d89ad
Comprar excepturi;Item de Compra;1;2024-06-06 08:24:31;;3;Cancelado;Jeferson Klau;b4853fc1f03a3a4cec530a98a94d89ad
Comprar sed;Item de Compra;1;2024-03-22 23:19:53;;3;Cancelado;Pedro da Silva;f9a533f2c78e4a09f87c9e68e442d3fe
Comprar repellat;Item de Compra;1;2024-07-17 20:00:48;;3;Cancelado;Pedro da Silva;f9a533f2c78e4a09f87c9e68e442d3fe
Delectus qui;Tarefa a Ser Feita;2;2024-11-01 23:39:19;;1;A Fazer;Pedro da Silva;f9a533f2c78e4a09f87c9e68e442d3fe
Occaecati sequi provident fugiat;Tarefa a Ser Feita;2;2023-12-01 11:21:12;;3;Cancelado;Pedro da Silva;f9a533f2c78e4a09f87c9e68e442d3fe
Rem ipsum eum;Tarefa a Ser Feita;2;2024-09-26 11:28:58;;1;A Fazer;Pedro da Silva;f9a533f2c78e4a09f87c9e68e442d3fe
Repellendus eos;Tarefa a Ser Feita;2;2023-11-24 07:26:49;2023-12-14 07:26:49;2;Concluído;Jeferson Klau;b4853fc1f03a3a4cec530a98a94d89ad
Commodi aliquam;Tarefa a Ser Feita;2;2023-07-30 12:09:33;;1;A Fazer;Jeferson Klau;b4853fc1f03a3a4cec530a98a94d89ad
Comprar incidunt;Item de Compra;1;2025-06-02 19:02:41;;3;Cancelado;Jeferson Klau;b4853fc1f03a3a4cec530a98a94d89ad
Quasi incidunt itaque;Tarefa a Ser Feita;2;2024-04-16 16:41:34;;1;A Fazer;Pedro da Silva;f9a533f2c78e4a09f87c9e68e442d3fe
Quos iure ab;Tarefa a Ser Feita;2;2025-05-18 20:05:25;;1;A Fazer;Pedro da Silva;f9a533f2c78e4a09f87c9e68e442d3fe
Culpa eos nulla voluptas doloremque fugiat;Tarefa a Ser Feita;2;2024-06-13 23:39:29;2025-06-02 21:35:40;2;Concluído;Pedro da Silva;f9a533f2c78e4a09f87c9e68e442d3fe
Comprar adipisci;Item de Compra;1;2024-08-21 06:42:53;;1;A Fazer;Jeferson Klau;b4853fc1f03a3a4cec530a98a94d89ad
Inventore voluptatibus quidem dolore;Tarefa a Ser Feita;2;2024-06-10 23:33:09;;3;Cancelado;Pedro da Silva;f9a533f2c78e4a09f87c9e68e442d3fe
Quas quibusdam aut temporibus similique quisquam laboriosam;Tarefa a Ser Feita;2;2024-05-20 16:51:15;2025-01-29 16:51:15;2;Concluído;Jeferson Klau;b4853fc1f03a3a4cec530a98a94d89ad
Comprar expedita;Item de Compra;1;2024-06-22 02:46:45;2024-07-09 02:46:45;2;Concluído;Jeferson Klau;b4853fc1f03a3a4cec530a98a94d89ad
Comprar cumque;Item de Compra;1;2024-02-29 03:11:46;2024-08-11 03:11:46;2;Concluído;Jeferson Klau;b4853fc1f03a3a4cec530a98a94d89ad
Assumenda ullam nihil;Tarefa a Ser Feita;2;2023-06-27 22:58:46;;1;A Fazer;Pedro da Silva;f9a533f2c78e4a09f87c9e68e442d3fe
Perspiciatis temporibus;Tarefa a Ser Feita;2;2024-11-13 00:44:47;;1;A Fazer;Jeferson Klau;b4853fc1f03a3a4cec530a98a94d89ad
Consequuntur vero eos nulla asperiores;Tarefa a Ser Feita;2;2023-10-20 08:52:56;;3;Cancelado;Jeferson Klau;b4853fc1f03a3a4cec530a98a94d89ad
Beatae totam molestias;Tarefa a Ser Feita;2;2024-12-07 20:17:17;2025-06-02 21:03:40;2;Concluído;Jeferson Klau;b4853fc1f03a3a4cec530a98a94d89ad
Comprar explicabo;Item de Compra;1;2023-12-20 00:49:43;;1;A Fazer;Pedro da Silva;f9a533f2c78e4a09f87c9e68e442d3fe
Comprar quaerat;Item de Compra;1;2023-09-07 00:39:28;2024-03-06 00:39:28;2;Concluído;Pedro da Silva;f9a533f2c78e4a09f87c9e68e442d3fe
Comprar dicta;Item de Compra;1;2024-07-18 11:40:20;;3;Cancelado;Pedro da Silva;f9a533f2c78e4a09f87c9e68e442d3fe
Cum quibusdam quae;Tarefa a Ser Feita;2;2024-11-16 09:41:12;;1;A Fazer;Jeferson Klau;b4853fc1f03a3a4cec530a98a94d89ad
Comprar blanditiis;Item de Compra;1;2024-10-05 03:07:36;2025-02-01 03:07:36;2;Concluído;Jeferson Klau;b4853fc1f03a3a4cec530a98a94d89ad
Aperiam omnis accusantium quasi;Tarefa a Ser Feita;2;2025-01-26 05:15:43;;1;A Fazer;Pedro da Silva;f9a533f2c78e4a09f87c9e68e442d3fe
Ea ad esse;Tarefa a Ser Feita;2;2023-12-29 11:03:21;;1;A Fazer;Pedro da Silva;f9a533f2c78e4a09f87c9e68e442d3fe
Cupiditate quaerat alias;Tarefa a Ser Feita;2;2025-02-07 12:43:22;;1;A Fazer;Jeferson Klau;b4853fc1f03a3a4cec530a98a94d89ad
Comprar adipisci;Item de Compra;1;2024-12-22 08:51:32;;1;A Fazer;Jeferson Klau;b4853fc1f03a3a4cec530a98a94d89ad
Fugiat harum;Tarefa a Ser Feita;2;2024-12-09 16:28:32;;3;Cancelado;Jeferson Klau;b4853fc1f03a3a4cec530a98a94d89ad
Comprar inventore;Item de Compra;1;2024-09-30 17:02:21;;3;Cancelado;Jeferson Klau;b4853fc1f03a3a4cec530a98a94d89ad
Fuga dolorem veritatis illo distinctio possimus;Tarefa a Ser Feita;2;2024-06-18 02:56:57;;1;A Fazer;Pedro da Silva;f9a533f2c78e4a09f87c9e68e442d3fe
Comprar necessitatibus;Item de Compra;1;2025-02-05 08:43:34;;3;Cancelado;Jeferson Klau;b4853fc1f03a3a4cec530a98a94d89ad
Aut error magnam provident illum;Tarefa a Ser Feita;2;2025-03-28 12:25:00;2025-05-28 12:25:00;2;Concluído;Jeferson Klau;b4853fc1f03a3a4cec530a98a94d89ad
Comprar in;Item de Compra;1;2025-01-20 10:19:54;2025-04-02 10:19:54;2;Concluído;Pedro da Silva;f9a533f2c78e4a09f87c9e68e442d3fe
Tempora ab inventore;Tarefa a Ser Feita;2;2024-02-04 17:29:34;;3;Cancelado;Jeferson Klau;b4853fc1f03a3a4cec530a98a94d89ad
Maxime rem aspernatur;Tarefa a Ser Feita;2;2024-07-15 03:26:07;2024-09-15 03:26:07;2;Concluído;Pedro da Silva;f9a533f2c78e4a09f87c9e68e442d3fe
Comprar id;Item de Compra;1;2024-10-31 18:04:38;;1;A Fazer;Jeferson Klau;b4853fc1f03a3a4cec530a98a94d89ad
Dicta quisquam;Tarefa a Ser Feita;2;2023-10-09 01:57:47;2024-02-14 01:57:47;2;Concluído;Jeferson Klau;b4853fc1f03a3a4cec530a98a94d89ad
Comprar sapiente;Item de Compra;1;2024-09-04 01:41:21;;3;Cancelado;Jeferson Klau;b4853fc1f03a3a4cec530a98a94d89ad
Nesciunt placeat possimus optio ratione;Tarefa a Ser Feita;2;2024-10-16 23:19:53;;3;Cancelado;Jeferson Klau;b4853fc1f03a3a4cec530a98a94d89ad
Sapiente ad animi iusto;Tarefa a Ser Feita;2;2025-03-16 22:35:02;;1;A Fazer;Pedro da Silva;f9a533f2c78e4a09f87c9e68e442d3fe
Sequi asperiores esse error dicta;Tarefa a Ser Feita;2;2023-09-29 07:38:57;;1;A Fazer;Pedro da Silva;f9a533f2c78e4a09f87c9e68e442d3fe
Iste accusamus;Tarefa a Ser Feita;2;2024-06-12 18:07:56;;1;A Fazer;Pedro da Silva;f9a533f2c78e4a09f87c9e68e442d3fe
Animi aliquam quia necessitatibus excepturi cum consectetur maxime;Tarefa a Ser Feita;2;2024-11-28 17:43:50;2025-06-02 21:19:40;2;Concluído;Pedro da Silva;f9a533f2c78e4a09f87c9e68e442d3fe
